id,label,organization_id,role,start_date,end_date,area_name
uk.org.publicwhip/cons/268,Member of Parliament for Halton,house-of-commons,Member of Parliament,1983,,Halton
uk.org.publicwhip/cons/269,Member of Parliament for Hamilton North and Bellshill,house-of-commons,Member of Parliament,1997-05-01,2005-05-04,Hamilton North and Bellshill
uk.org.publicwhip/cons/27,Member of Parliament for Basingstoke,house-of-commons,Member of Parliament,1885,,Basingstoke
uk.org.publicwhip/cons/270,Member of Parliament for Hamilton South,house-of-commons,Member of Parliament,1997-05-01,2005-05-04,Hamilton South
uk.org.publicwhip/cons/271,Member of Parliament for Hammersmith and Fulham,house-of-commons,Member of Parliament,1997-05-01,2010-05-05,Hammersmith and Fulham
uk.org.publicwhip/cons/272,Member of Parliament for Hampstead and Highgate,house-of-commons,Member of Parliament,1983,2010-05-05,Hampstead and Highgate
uk.org.publicwhip/cons/273,Member of Parliament for Harborough,house-of-commons,Member of Parliament,1885,,Harborough
uk.org.publicwhip/cons/274,Member of Parliament for Harlow,house-of-commons,Member of Parliament,1974,,Harlow
uk.org.publicwhip/cons/275,Member of Parliament for Harrogate and Knaresborough,house-of-commons,Member of Parliament,1997-05-01,,Harrogate and Knaresborough
uk.org.publicwhip/cons/276,Member of Parliament for Harrow East,house-of-commons,Member of Parliament,1945,,Harrow East
uk.org.publicwhip/cons/277,Member of Parliament for Harrow West,house-of-commons,Member of Parliament,1945,,Harrow West
uk.org.publicwhip/cons/278,Member of Parliament for Hartlepool,house-of-commons,Member of Parliament,1974,,Hartlepool
uk.org.publicwhip/cons/279,Member of Parliament for Harwich,house-of-commons,Member of Parliament,1660,2010-05-05,Harwich
uk.org.publicwhip/cons/28,Member of Parliament for Bassetlaw,house-of-commons,Member of Parliament,1885,,Bassetlaw
uk.org.publicwhip/cons/280,Member of Parliament for Hastings and Rye,house-of-commons,Member of Parliament,1983,,Hastings and Rye
uk.org.publicwhip/cons/281,Member of Parliament for Havant,house-of-commons,Member of Parliament,1983,,Havant
uk.org.publicwhip/cons/282,Member of Parliament for Hayes and Harlington,house-of-commons,Member of Parliament,1983,,Hayes and Harlington
uk.org.publicwhip/cons/283,Member of Parliament for Hazel Grove,house-of-commons,Member of Parliament,1974,,Hazel Grove
uk.org.publicwhip/cons/284,Member of Parliament for Hemel Hempstead,house-of-commons,Member of Parliament,1997-05-01,,Hemel Hempstead
uk.org.publicwhip/cons/285,Member of Parliament for Hemsworth,house-of-commons,Member of Parliament,1918,,Hemsworth
uk.org.publicwhip/cons/286,Member of Parliament for Hendon,house-of-commons,Member of Parliament,1997-05-01,,Hendon
uk.org.publicwhip/cons/287,Member of Parliament for Henley,house-of-commons,Member of Parliament,1885,,Henley
uk.org.publicwhip/cons/288,Member of Parliament for Hereford,house-of-commons,Member of Parliament,1660,2010-05-05,Hereford
uk.org.publicwhip/cons/289,Member of Parliament for Hertford and Stortford,house-of-commons,Member of Parliament,1983,,Hertford and Stortford
uk.org.publicwhip/cons/29,Member of Parliament for Bath,house-of-commons,Member of Parliament,1660,,Bath
uk.org.publicwhip/cons/290,Member of Parliament for Hertsmere,house-of-commons,Member of Parliament,1983,,Hertsmere
uk.org.publicwhip/cons/291,Member of Parliament for Hexham,house-of-commons,Member of Parliament,1885,,Hexham
uk.org.publicwhip/cons/292,Member of Parliament for Heywood and Middleton,house-of-commons,Member of Parliament,1983,,Heywood and Middleton
uk.org.publicwhip/cons/293,Member of Parliament for High Peak,house-of-commons,Member of Parliament,1885,,High Peak
uk.org.publicwhip/cons/294,Member of Parliament for Hitchin and Harpenden,house-of-commons,Member of Parliament,1997-05-01,,Hitchin and Harpenden
uk.org.publicwhip/cons/295,Member of Parliament for Holborn and St Pancras,house-of-commons,Member of Parliament,1983,,Holborn and St Pancras
uk.org.publicwhip/cons/296,Member of Parliament for Hornchurch,house-of-commons,Member of Parliament,1918,2010-05-05,Hornchurch
uk.org.publicwhip/cons/297,Member of Parliament for Hornsey and Wood Green,house-of-commons,Member of Parliament,1983,,Hornsey and Wood Green
uk.org.publicwhip/cons/298,Member of Parliament for Horsham,house-of-commons,Member of Parliament,1983,,Horsham
uk.org.publicwhip/cons/299,Member of Parliament for Houghton and Washington East,house-of-commons,Member of Parliament,1997-05-01,2010-05-05,Houghton and Washington East
uk.org.publicwhip/cons/3,Member of Parliament for Aberdeen North,house-of-commons,Member of Parliament,1885,,Aberdeen North
uk.org.publicwhip/cons/30,Member of Parliament for Batley and Spen,house-of-commons,Member of Parliament,1983,,Batley and Spen
uk.org.publicwhip/cons/300,Member of Parliament for Hove,house-of-commons,Member of Parliament,1950,,Hove
uk.org.publicwhip/cons/301,Member of Parliament for Huddersfield,house-of-commons,Member of Parliament,1983,,Huddersfield
uk.org.publicwhip/cons/302,Member of Parliament for Huntingdon,house-of-commons,Member of Parliament,1983,,Huntingdon
uk.org.publicwhip/cons/303,Member of Parliament for Hyndburn,house-of-commons,Member of Parliament,1983,,Hyndburn
uk.org.publicwhip/cons/304,Member of Parliament for Ilford North,house-of-commons,Member of Parliament,1918,,Ilford North
uk.org.publicwhip/cons/305,Member of Parliament for Ilford South,house-of-commons,Member of Parliament,1918,,Ilford South
uk.org.publicwhip/cons/306,"Member of Parliament for Inverness East, Nairn and Lochaber",house-of-commons,Member of Parliament,1997-05-01,2005-05-04,"Inverness East, Nairn and Lochaber"
uk.org.publicwhip/cons/307,Member of Parliament for Ipswich,house-of-commons,Member of Parliament,1660,,Ipswich
uk.org.publicwhip/cons/308,Member of Parliament for Isle of Wight,house-of-commons,Member of Parliament,1832,,Isle of Wight
uk.org.publicwhip/cons/309,Member of Parliament for Islington North,house-of-commons,Member of Parliament,1885,,Islington North
uk.org.publicwhip/cons/31,Member of Parliament for Battersea,house-of-commons,Member of Parliament,1983,,Battersea
uk.org.publicwhip/cons/310,Member of Parliament for Islington South and Finsbury,house-of-commons,Member of Parliament,1974,,Islington South and Finsbury
uk.org.publicwhip/cons/311,Member of Parliament for Islwyn,house-of-commons,Member of Parliament,1983,,Islwyn
uk.org.publicwhip/cons/312,Member of Parliament for Jarrow,house-of-commons,Member of Parliament,1885,,Jarrow
uk.org.publicwhip/cons/313,Member of Parliament for Keighley,house-of-commons,Member of Parliament,1885,,Keighley
uk.org.publicwhip/cons/314,Member of Parliament for Kensington and Chelsea,house-of-commons,Member of Parliament,1997-05-01,2010-05-05,Kensington and Chelsea
uk.org.publicwhip/cons/315,Member of Parliament for Kettering,house-of-commons,Member of Parliament,1918,,Kettering
uk.org.publicwhip/cons/316,Member of Parliament for Kilmarnock and Loudoun,house-of-commons,Member of Parliament,1983,,Kilmarnock and Loudoun
uk.org.publicwhip/cons/317,Member of Parliament for Kingston and Surbiton,house-of-commons,Member of Parliament,1997-05-01,,Kingston and Surbiton
uk.org.publicwhip/cons/318,Member of Parliament for Kingston upon Hull East,house-of-commons,Member of Parliament,1885,,Kingston upon Hull East
uk.org.publicwhip/cons/319,Member of Parliament for Kingston upon Hull North,house-of-commons,Member of Parliament,1983,,Kingston upon Hull North
uk.org.publicwhip/cons/32,Member of Parliament for Beaconsfield,house-of-commons,Member of Parliament,1974,,Beaconsfield
uk.org.publicwhip/cons/320,Member of Parliament for Kingston upon Hull West and Hessle,house-of-commons,Member of Parliament,1997-05-01,,Kingston upon Hull West and Hessle
uk.org.publicwhip/cons/321,Member of Parliament for Kingswood,house-of-commons,Member of Parliament,1974,,Kingswood
uk.org.publicwhip/cons/322,Member of Parliament for Kirkcaldy,house-of-commons,Member of Parliament,1974,2005-05-04,Kirkcaldy
uk.org.publicwhip/cons/323,Member of Parliament for Knowsley North and Sefton East,house-of-commons,Member of Parliament,1997-05-01,2010-05-05,Knowsley North and Sefton East
uk.org.publicwhip/cons/324,Member of Parliament for Knowsley South,house-of-commons,Member of Parliament,1983,2010-05-05,Knowsley South
uk.org.publicwhip/cons/325,Member of Parliament for Lagan Valley,house-of-commons,Member of Parliament,1983,,Lagan Valley
uk.org.publicwhip/cons/325-NI,MLA for Lagan Valley,northern-ireland-assembly,MLA,,,Lagan Valley
uk.org.publicwhip/cons/326,Member of Parliament for Lancaster and Wyre,house-of-commons,Member of Parliament,1997-05-01,2010-05-05,Lancaster and Wyre
uk.org.publicwhip/cons/327,Member of Parliament for Leeds Central,house-of-commons,Member of Parliament,1983,,Leeds Central
uk.org.publicwhip/cons/328,Member of Parliament for Leeds East,house-of-commons,Member of Parliament,1955,,Leeds East
uk.org.publicwhip/cons/329,Member of Parliament for Leeds North East,house-of-commons,Member of Parliament,1918,,Leeds North East
uk.org.publicwhip/cons/33,Member of Parliament for Beckenham,house-of-commons,Member of Parliament,1950,,Beckenham
uk.org.publicwhip/cons/330,Member of Parliament for Leeds North West,house-of-commons,Member of Parliament,1950,,Leeds North West
uk.org.publicwhip/cons/331,Member of Parliament for Leeds West,house-of-commons,Member of Parliament,1885,,Leeds West
uk.org.publicwhip/cons/332,Member of Parliament for Leicester East,house-of-commons,Member of Parliament,1974,,Leicester East
uk.org.publicwhip/cons/333,Member of Parliament for Leicester South,house-of-commons,Member of Parliament,1974,,Leicester South
uk.org.publicwhip/cons/334,Member of Parliament for Leicester West,house-of-commons,Member of Parliament,1974,,Leicester West
uk.org.publicwhip/cons/335,Member of Parliament for Leigh,house-of-commons,Member of Parliament,1885,,Leigh
uk.org.publicwhip/cons/336,Member of Parliament for Leominster,house-of-commons,Member of Parliament,1660,2010-05-05,Leominster
uk.org.publicwhip/cons/337,Member of Parliament for Lewes,house-of-commons,Member of Parliament,1660,,Lewes
uk.org.publicwhip/cons/338,Member of Parliament for Lewisham East,house-of-commons,Member of Parliament,1974,,Lewisham East
uk.org.publicwhip/cons/339,Member of Parliament for Lewisham West,house-of-commons,Member of Parliament,1918,2010-05-05,Lewisham West
uk.org.publicwhip/cons/34,Member of Parliament for Bedford,house-of-commons,Member of Parliament,1997-05-01,,Bedford
uk.org.publicwhip/cons/340,"Member of Parliament for Lewisham, Deptford",house-of-commons,Member of Parliament,1974,,"Lewisham, Deptford"
uk.org.publicwhip/cons/341,Member of Parliament for Leyton and Wanstead,house-of-commons,Member of Parliament,1997-05-01,,Leyton and Wanstead
uk.org.publicwhip/cons/342,Member of Parliament for Lichfield,house-of-commons,Member of Parliament,1997-05-01,,Lichfield
uk.org.publicwhip/cons/343,Member of Parliament for Lincoln,house-of-commons,Member of Parliament,1660,,Lincoln
uk.org.publicwhip/cons/344,Member of Parliament for Linlithgow,house-of-commons,Member of Parliament,1983,2005-05-04,Linlithgow
uk.org.publicwhip/cons/345,"Member of Parliament for Liverpool, Garston",house-of-commons,Member of Parliament,1950,2010-05-05,"Liverpool, Garston"
uk.org.publicwhip/cons/346,"Member of Parliament for Liverpool, Riverside",house-of-commons,Member of Parliament,1983,,"Liverpool, Riverside"
uk.org.publicwhip/cons/347,"Member of Parliament for Liverpool, Walton",house-of-commons,Member of Parliament,1885,,"Liverpool, Walton"
uk.org.publicwhip/cons/348,"Member of Parliament for Liverpool, Wavertree",house-of-commons,Member of Parliament,1997-05-01,,"Liverpool, Wavertree"
uk.org.publicwhip/cons/349,"Member of Parliament for Liverpool, West Derby",house-of-commons,Member of Parliament,1885,,"Liverpool, West Derby"
uk.org.publicwhip/cons/35,Member of Parliament for Belfast East,house-of-commons,Member of Parliament,1922,,Belfast East
uk.org.publicwhip/cons/35-NI,MLA for Belfast East,northern-ireland-assembly,MLA,,,Belfast East
uk.org.publicwhip/cons/350,Member of Parliament for Livingston,house-of-commons,Member of Parliament,1983,,Livingston
uk.org.publicwhip/cons/351,Member of Parliament for Llanelli,house-of-commons,Member of Parliament,1950,,Llanelli
uk.org.publicwhip/cons/352,Member of Parliament for Loughborough,house-of-commons,Member of Parliament,1885,,Loughborough
uk.org.publicwhip/cons/353,Member of Parliament for Louth and Horncastle,house-of-commons,Member of Parliament,1997-05-01,,Louth and Horncastle
uk.org.publicwhip/cons/354,Member of Parliament for Ludlow,house-of-commons,Member of Parliament,1660,,Ludlow
uk.org.publicwhip/cons/355,Member of Parliament for Luton North,house-of-commons,Member of Parliament,1983,,Luton North
uk.org.publicwhip/cons/356,Member of Parliament for Luton South,house-of-commons,Member of Parliament,1983,,Luton South
uk.org.publicwhip/cons/357,Member of Parliament for Macclesfield,house-of-commons,Member of Parliament,1832,,Macclesfield
uk.org.publicwhip/cons/358,Member of Parliament for Maidenhead,house-of-commons,Member of Parliament,1997-05-01,,Maidenhead
uk.org.publicwhip/cons/359,Member of Parliament for Maidstone and The Weald,house-of-commons,Member of Parliament,1997-05-01,,Maidstone and The Weald
uk.org.publicwhip/cons/36,Member of Parliament for Belfast North,house-of-commons,Member of Parliament,1922,,Belfast North
uk.org.publicwhip/cons/36-NI,MLA for Belfast North,northern-ireland-assembly,MLA,,,Belfast North
uk.org.publicwhip/cons/360,Member of Parliament for Makerfield,house-of-commons,Member of Parliament,1983,,Makerfield
uk.org.publicwhip/cons/361,Member of Parliament for Maldon and East Chelmsford,house-of-commons,Member of Parliament,1997-05-01,2010-05-05,Maldon and East Chelmsford
uk.org.publicwhip/cons/362,Member of Parliament for Manchester Central,house-of-commons,Member of Parliament,1974,,Manchester Central
uk.org.publicwhip/cons/363,"Member of Parliament for Manchester, Blackley",house-of-commons,Member of Parliament,1918,2010-05-05,"Manchester, Blackley"
uk.org.publicwhip/cons/364,"Member of Parliament for Manchester, Gorton",house-of-commons,Member of Parliament,1918,,"Manchester, Gorton"
uk.org.publicwhip/cons/365,"Member of Parliament for Manchester, Withington",house-of-commons,Member of Parliament,1918,,"Manchester, Withington"
uk.org.publicwhip/cons/366,Member of Parliament for Mansfield,house-of-commons,Member of Parliament,1885,,Mansfield
uk.org.publicwhip/cons/367,Member of Parliament for Medway,house-of-commons,Member of Parliament,1885,2010-05-05,Medway
uk.org.publicwhip/cons/368,Member of Parliament for Meirionnydd Nant Conwy,house-of-commons,Member of Parliament,1983,2010-05-05,Meirionnydd Nant Conwy
uk.org.publicwhip/cons/369,Member of Parliament for Meriden,house-of-commons,Member of Parliament,1950,,Meriden
uk.org.publicwhip/cons/37,Member of Parliament for Belfast South,house-of-commons,Member of Parliament,1922,,Belfast South
uk.org.publicwhip/cons/37-NI,MLA for Belfast South,northern-ireland-assembly,MLA,,,Belfast South
uk.org.publicwhip/cons/370,Member of Parliament for Merthyr Tydfil and Rhymney,house-of-commons,Member of Parliament,1983,,Merthyr Tydfil and Rhymney
uk.org.publicwhip/cons/371,Member of Parliament for Mid Bedfordshire,house-of-commons,Member of Parliament,1918,,Mid Bedfordshire
uk.org.publicwhip/cons/372,Member of Parliament for Mid Dorset and North Poole,house-of-commons,Member of Parliament,1997-05-01,,Mid Dorset and North Poole
uk.org.publicwhip/cons/373,Member of Parliament for Mid Norfolk,house-of-commons,Member of Parliament,1983,,Mid Norfolk
uk.org.publicwhip/cons/374,Member of Parliament for Mid Sussex,house-of-commons,Member of Parliament,1974,,Mid Sussex
uk.org.publicwhip/cons/375,Member of Parliament for Mid Ulster,house-of-commons,Member of Parliament,1974,,Mid Ulster
uk.org.publicwhip/cons/375-NI,MLA for Mid Ulster,northern-ireland-assembly,MLA,,,Mid Ulster
uk.org.publicwhip/cons/376,Member of Parliament for Mid Worcestershire,house-of-commons,Member of Parliament,1983,,Mid Worcestershire
uk.org.publicwhip/cons/377,Member of Parliament for Middlesbrough,house-of-commons,Member of Parliament,1983,,Middlesbrough
uk.org.publicwhip/cons/378,Member of Parliament for Middlesbrough South and East Cleveland,house-of-commons,Member of Parliament,1997-05-01,,Middlesbrough South and East Cleveland
uk.org.publicwhip/cons/379,Member of Parliament for Midlothian,house-of-commons,Member of Parliament,1955,,Midlothian
uk.org.publicwhip/cons/38,Member of Parliament for Belfast West,house-of-commons,Member of Parliament,1922,,Belfast West
uk.org.publicwhip/cons/38-NI,MLA for Belfast West,northern-ireland-assembly,MLA,,,Belfast West
uk.org.publicwhip/cons/380,Member of Parliament for Milton Keynes South West,house-of-commons,Member of Parliament,1992,2010-05-05,Milton Keynes South West
uk.org.publicwhip/cons/381,Member of Parliament for Mitcham and Morden,house-of-commons,Member of Parliament,1983,,Mitcham and Morden
uk.org.publicwhip/cons/382,Member of Parliament for Mole Valley,house-of-commons,Member of Parliament,1983,,Mole Valley
uk.org.publicwhip/cons/383,Member of Parliament for Monmouth,house-of-commons,Member of Parliament,1918,,Monmouth
uk.org.publicwhip/cons/384,Member of Parliament for Montgomeryshire,house-of-commons,Member of Parliament,1997-05-01,,Montgomeryshire
uk.org.publicwhip/cons/385,Member of Parliament for Moray,house-of-commons,Member of Parliament,1983,,Moray
uk.org.publicwhip/cons/386,Member of Parliament for Morecambe and Lunesdale,house-of-commons,Member of Parliament,1983,,Morecambe and Lunesdale
uk.org.publicwhip/cons/387,Member of Parliament for Morley and Rothwell,house-of-commons,Member of Parliament,1997-05-01,2010-05-05,Morley and Rothwell
uk.org.publicwhip/cons/388,Member of Parliament for Motherwell and Wishaw,house-of-commons,Member of Parliament,1974,,Motherwell and Wishaw
uk.org.publicwhip/cons/389,Member of Parliament for Neath,house-of-commons,Member of Parliament,1918,,Neath
uk.org.publicwhip/cons/39,Member of Parliament for Berwick-upon-Tweed,house-of-commons,Member of Parliament,1660,,Berwick-upon-Tweed
uk.org.publicwhip/cons/390,Member of Parliament for New Forest East,house-of-commons,Member of Parliament,1997-05-01,,New Forest East
uk.org.publicwhip/cons/391,Member of Parliament for New Forest West,house-of-commons,Member of Parliament,1997-05-01,,New Forest West
uk.org.publicwhip/cons/392,Member of Parliament for Newark,house-of-commons,Member of Parliament,1673,,Newark
uk.org.publicwhip/cons/393,Member of Parliament for Newbury,house-of-commons,Member of Parliament,1885,,Newbury
uk.org.publicwhip/cons/394,Member of Parliament for Newcastle upon Tyne Central,house-of-commons,Member of Parliament,1918,,Newcastle upon Tyne Central
uk.org.publicwhip/cons/395,Member of Parliament for Newcastle upon Tyne East and Wallsend,house-of-commons,Member of Parliament,1997-05-01,2010-05-05,Newcastle upon Tyne East and Wallsend
uk.org.publicwhip/cons/396,Member of Parliament for Newcastle upon Tyne North,house-of-commons,Member of Parliament,1918,,Newcastle upon Tyne North
uk.org.publicwhip/cons/397,Member of Parliament for Newcastle-under-Lyme,house-of-commons,Member of Parliament,1660,,Newcastle-under-Lyme
uk.org.publicwhip/cons/398,Member of Parliament for Newport East,house-of-commons,Member of Parliament,1983,,Newport East
uk.org.publicwhip/cons/399,Member of Parliament for Newport West,house-of-commons,Member of Parliament,1983,,Newport West
uk.org.publicwhip/cons/4,Member of Parliament for Aberdeen South,house-of-commons,Member of Parliament,1885,,Aberdeen South
uk.org.publicwhip/cons/40,Member of Parliament for Bethnal Green and Bow,house-of-commons,Member of Parliament,1997-05-01,,Bethnal Green and Bow
uk.org.publicwhip/cons/400,Member of Parliament for Newry and Armagh,house-of-commons,Member of Parliament,1983,,Newry and Armagh
uk.org.publicwhip/cons/400-NI,MLA for Newry and Armagh,northern-ireland-assembly,MLA,,,Newry and Armagh
uk.org.publicwhip/cons/401,Member of Parliament for Normanton,house-of-commons,Member of Parliament,1885,2010-05-05,Normanton
uk.org.publicwhip/cons/402,Member of Parliament for North Antrim,house-of-commons,Member of Parliament,1922,,North Antrim
uk.org.publicwhip/cons/402-NI,MLA for North Antrim,northern-ireland-assembly,MLA,,,North Antrim
uk.org.publicwhip/cons/403,Member of Parliament for North Cornwall,house-of-commons,Member of Parliament,1950,,North Cornwall
uk.org.publicwhip/cons/404,Member of Parliament for North Devon,house-of-commons,Member of Parliament,1950,,North Devon
uk.org.publicwhip/cons/405,Member of Parliament for North Dorset,house-of-commons,Member of Parliament,1950,,North Dorset
uk.org.publicwhip/cons/406,Member of Parliament for North Down,house-of-commons,Member of Parliament,1950,,North Down
uk.org.publicwhip/cons/406-NI,MLA for North Down,northern-ireland-assembly,MLA,,,North Down
uk.org.publicwhip/cons/407,Member of Parliament for North Durham,house-of-commons,Member of Parliament,1983,,North Durham
uk.org.publicwhip/cons/408,Member of Parliament for North East Bedfordshire,house-of-commons,Member of Parliament,1997-05-01,,North East Bedfordshire
uk.org.publicwhip/cons/409,Member of Parliament for North East Cambridgeshire,house-of-commons,Member of Parliament,1983,,North East Cambridgeshire
uk.org.publicwhip/cons/41,Member of Parliament for Beverley and Holderness,house-of-commons,Member of Parliament,1997-05-01,,Beverley and Holderness
uk.org.publicwhip/cons/410,Member of Parliament for North East Derbyshire,house-of-commons,Member of Parliament,1950,,North East Derbyshire
uk.org.publicwhip/cons/411,Member of Parliament for North East Fife,house-of-commons,Member of Parliament,1983,,North East Fife
uk.org.publicwhip/cons/412,Member of Parliament for North East Hampshire,house-of-commons,Member of Parliament,1997-05-01,,North East Hampshire
uk.org.publicwhip/cons/413,Member of Parliament for North East Hertfordshire,house-of-commons,Member of Parliament,1997-05-01,,North East Hertfordshire
uk.org.publicwhip/cons/414,Member of Parliament for North East Milton Keynes,house-of-commons,Member of Parliament,1992,2010-05-05,North East Milton Keynes
uk.org.publicwhip/cons/415,Member of Parliament for North Essex,house-of-commons,Member of Parliament,1997-05-01,2010-05-05,North Essex
uk.org.publicwhip/cons/416,Member of Parliament for North Norfolk,house-of-commons,Member of Parliament,1950,,North Norfolk
uk.org.publicwhip/cons/417,Member of Parliament for North Shropshire,house-of-commons,Member of Parliament,1983,,North Shropshire
uk.org.publicwhip/cons/418,Member of Parliament for North Southwark and Bermondsey,house-of-commons,Member of Parliament,1997-05-01,2010-05-05,North Southwark and Bermondsey
uk.org.publicwhip/cons/419,Member of Parliament for North Swindon,house-of-commons,Member of Parliament,1997-05-01,,North Swindon
uk.org.publicwhip/cons/42,Member of Parliament for Bexhill and Battle,house-of-commons,Member of Parliament,1983,,Bexhill and Battle
uk.org.publicwhip/cons/420,Member of Parliament for North Tayside,house-of-commons,Member of Parliament,1983,2005-05-04,North Tayside
uk.org.publicwhip/cons/421,Member of Parliament for North Thanet,house-of-commons,Member of Parliament,1983,,North Thanet
uk.org.publicwhip/cons/422,Member of Parliament for North Tyneside,house-of-commons,Member of Parliament,1997-05-01,,North Tyneside
uk.org.publicwhip/cons/423,Member of Parliament for North Warwickshire,house-of-commons,Member of Parliament,1983,,North Warwickshire
uk.org.publicwhip/cons/424,Member of Parliament for North West Cambridgeshire,house-of-commons,Member of Parliament,1997-05-01,,North West Cambridgeshire
uk.org.publicwhip/cons/425,Member of Parliament for North West Durham,house-of-commons,Member of Parliament,1950,,North West Durham
uk.org.publicwhip/cons/426,Member of Parliament for North West Hampshire,house-of-commons,Member of Parliament,1983,,North West Hampshire
uk.org.publicwhip/cons/427,Member of Parliament for North West Leicestershire,house-of-commons,Member of Parliament,1983,,North West Leicestershire
uk.org.publicwhip/cons/428,Member of Parliament for North West Norfolk,house-of-commons,Member of Parliament,1974,,North West Norfolk
uk.org.publicwhip/cons/429,Member of Parliament for North Wiltshire,house-of-commons,Member of Parliament,1983,,North Wiltshire
uk.org.publicwhip/cons/43,Member of Parliament for Bexleyheath and Crayford,house-of-commons,Member of Parliament,1997-05-01,,Bexleyheath and Crayford
uk.org.publicwhip/cons/430,Member of Parliament for Northampton North,house-of-commons,Member of Parliament,1974,,Northampton North
uk.org.publicwhip/cons/431,Member of Parliament for Northampton South,house-of-commons,Member of Parliament,1974,,Northampton South
uk.org.publicwhip/cons/432,Member of Parliament for Northavon,house-of-commons,Member of Parliament,1983,2010-05-05,Northavon
uk.org.publicwhip/cons/433,Member of Parliament for Norwich North,house-of-commons,Member of Parliament,1950,,Norwich North
uk.org.publicwhip/cons/434,Member of Parliament for Norwich South,house-of-commons,Member of Parliament,1950,,Norwich South
uk.org.publicwhip/cons/435,Member of Parliament for Nottingham East,house-of-commons,Member of Parliament,1974,,Nottingham East
uk.org.publicwhip/cons/436,Member of Parliament for Nottingham North,house-of-commons,Member of Parliament,1955,,Nottingham North
uk.org.publicwhip/cons/437,Member of Parliament for Nottingham South,house-of-commons,Member of Parliament,1983,,Nottingham South
uk.org.publicwhip/cons/438,Member of Parliament for Nuneaton,house-of-commons,Member of Parliament,1885,,Nuneaton
uk.org.publicwhip/cons/439,Member of Parliament for Ochil,house-of-commons,Member of Parliament,1997-05-01,2005-05-04,Ochil
