id,label,organization_id,role,start_date,end_date,area_name
uk.org.publicwhip/cons/1426,Member of Parliament for Belfast Duncairn,house-of-commons,Member of Parliament,1918,1922,Belfast Duncairn
uk.org.publicwhip/cons/1427,Member of Parliament for Belfast Falls,house-of-commons,Member of Parliament,1918,1922,Belfast Falls
uk.org.publicwhip/cons/1428,Member of Parliament for Belfast Ormeau,house-of-commons,Member of Parliament,1918,1922,Belfast Ormeau
uk.org.publicwhip/cons/1429,Member of Parliament for Belfast Pottinger,house-of-commons,Member of Parliament,1918,1922,Belfast Pottinger
uk.org.publicwhip/cons/143,Member of Parliament for Coatbridge and Chryston,house-of-commons,Member of Parliament,1997-05-01,2005-05-04,Coatbridge and Chryston
uk.org.publicwhip/cons/1430,Member of Parliament for Belfast St Anne's,house-of-commons,Member of Parliament,1918,1922,Belfast St Anne's
uk.org.publicwhip/cons/1431,Member of Parliament for Belfast Shankill,house-of-commons,Member of Parliament,1918,1922,Belfast Shankill
uk.org.publicwhip/cons/1432,Member of Parliament for Belfast Victoria,house-of-commons,Member of Parliament,1918,1922,Belfast Victoria
uk.org.publicwhip/cons/1433,Member of Parliament for Belfast Woodvale,house-of-commons,Member of Parliament,1918,1922,Belfast Woodvale
uk.org.publicwhip/cons/1434,Member of Parliament for Dublin Clontarf,house-of-commons,Member of Parliament,1918,1922,Dublin Clontarf
uk.org.publicwhip/cons/1435,Member of Parliament for Dublin College Green,house-of-commons,Member of Parliament,1885,1922,Dublin College Green
uk.org.publicwhip/cons/1436,Member of Parliament for Dublin St James's,house-of-commons,Member of Parliament,1918,1922,Dublin St James's
uk.org.publicwhip/cons/1437,Member of Parliament for Dublin St Patrick's,house-of-commons,Member of Parliament,1885,1922,Dublin St Patrick's
uk.org.publicwhip/cons/1438,Member of Parliament for Dublin St Stephen's Green,house-of-commons,Member of Parliament,1885,1922,Dublin St Stephen's Green
uk.org.publicwhip/cons/1439,Member of Parliament for Londonderry Borough,house-of-commons,Member of Parliament,1802,1922,Londonderry Borough
uk.org.publicwhip/cons/144,Member of Parliament for Colchester,house-of-commons,Member of Parliament,1997-05-01,,Colchester
uk.org.publicwhip/cons/1440,Member of Parliament for County Waterford,house-of-commons,Member of Parliament,1918,1922,County Waterford
uk.org.publicwhip/cons/1441,Member of Parliament for Antrim Mid,house-of-commons,Member of Parliament,1885,1922,Antrim Mid
uk.org.publicwhip/cons/1442,Member of Parliament for Armagh Mid,house-of-commons,Member of Parliament,1885,1922,Armagh Mid
uk.org.publicwhip/cons/1443,Member of Parliament for Armagh North,house-of-commons,Member of Parliament,1885,1922,Armagh North
uk.org.publicwhip/cons/1444,Member of Parliament for Armagh South,house-of-commons,Member of Parliament,1885,1922,Armagh South
uk.org.publicwhip/cons/1445,Member of Parliament for Cavan East,house-of-commons,Member of Parliament,1885,1922,Cavan East
uk.org.publicwhip/cons/1446,Member of Parliament for Clare East,house-of-commons,Member of Parliament,1885,1922,Clare East
uk.org.publicwhip/cons/1447,Member of Parliament for Clare West,house-of-commons,Member of Parliament,1885,1922,Clare West
uk.org.publicwhip/cons/1448,Member of Parliament for Cork East,house-of-commons,Member of Parliament,1885,1922,Cork East
uk.org.publicwhip/cons/1449,Member of Parliament for Cork Mid,house-of-commons,Member of Parliament,1885,1922,Cork Mid
uk.org.publicwhip/cons/145,Member of Parliament for Colne Valley,house-of-commons,Member of Parliament,1885,,Colne Valley
uk.org.publicwhip/cons/1450,Member of Parliament for Cork North,house-of-commons,Member of Parliament,1885,1922,Cork North
uk.org.publicwhip/cons/1451,Member of Parliament for Cork South,house-of-commons,Member of Parliament,1885,1922,Cork South
uk.org.publicwhip/cons/1452,Member of Parliament for Cork South East,house-of-commons,Member of Parliament,1885,1922,Cork South East
uk.org.publicwhip/cons/1453,Member of Parliament for Cork West,house-of-commons,Member of Parliament,1885,1922,Cork West
uk.org.publicwhip/cons/1454,Member of Parliament for Donegal East,house-of-commons,Member of Parliament,1885,1922,Donegal East
uk.org.publicwhip/cons/1455,Member of Parliament for Donegal North,house-of-commons,Member of Parliament,1885,1922,Donegal North
uk.org.publicwhip/cons/1456,Member of Parliament for Donegal South,house-of-commons,Member of Parliament,1885,1922,Donegal South
uk.org.publicwhip/cons/1457,Member of Parliament for Donegal West,house-of-commons,Member of Parliament,1885,1922,Donegal West
uk.org.publicwhip/cons/1458,Member of Parliament for Down East,house-of-commons,Member of Parliament,1885,1922,Down East
uk.org.publicwhip/cons/1459,Member of Parliament for Down Mid,house-of-commons,Member of Parliament,1918,1922,Down Mid
uk.org.publicwhip/cons/146,Member of Parliament for Congleton,house-of-commons,Member of Parliament,1983,,Congleton
uk.org.publicwhip/cons/1460,Member of Parliament for Down West,house-of-commons,Member of Parliament,1885,1922,Down West
uk.org.publicwhip/cons/1461,Member of Parliament for Dublin North,house-of-commons,Member of Parliament,1885,1922,Dublin North
uk.org.publicwhip/cons/1462,Member of Parliament for Dublin Pembroke,house-of-commons,Member of Parliament,1918,1922,Dublin Pembroke
uk.org.publicwhip/cons/1463,Member of Parliament for Dublin Rathmines,house-of-commons,Member of Parliament,1918,1922,Dublin Rathmines
uk.org.publicwhip/cons/1464,Member of Parliament for Dublin South,house-of-commons,Member of Parliament,1885,1922,Dublin South
uk.org.publicwhip/cons/1465,Member of Parliament for Fermanagh North,house-of-commons,Member of Parliament,1885,1922,Fermanagh North
uk.org.publicwhip/cons/1466,Member of Parliament for Fermanagh South,house-of-commons,Member of Parliament,1885,1922,Fermanagh South
uk.org.publicwhip/cons/1467,Member of Parliament for Galway Connemara,house-of-commons,Member of Parliament,1885,1922,Galway Connemara
uk.org.publicwhip/cons/1468,Member of Parliament for Galway East,house-of-commons,Member of Parliament,1885,1922,Galway East
uk.org.publicwhip/cons/1469,Member of Parliament for Galway North,house-of-commons,Member of Parliament,1885,1922,Galway North
uk.org.publicwhip/cons/147,Member of Parliament for Conwy,house-of-commons,Member of Parliament,1983,2010-05-05,Conwy
uk.org.publicwhip/cons/1470,Member of Parliament for Galway South,house-of-commons,Member of Parliament,1885,1922,Galway South
uk.org.publicwhip/cons/1471,Member of Parliament for Kerry East,house-of-commons,Member of Parliament,1885,1922,Kerry East
uk.org.publicwhip/cons/1472,Member of Parliament for Kerry North,house-of-commons,Member of Parliament,1885,1922,Kerry North
uk.org.publicwhip/cons/1473,Member of Parliament for Kerry South,house-of-commons,Member of Parliament,1885,1922,Kerry South
uk.org.publicwhip/cons/1474,Member of Parliament for Kerry West,house-of-commons,Member of Parliament,1885,1922,Kerry West
uk.org.publicwhip/cons/1475,Member of Parliament for Kildare North,house-of-commons,Member of Parliament,1885,1922,Kildare North
uk.org.publicwhip/cons/1476,Member of Parliament for Kildare South,house-of-commons,Member of Parliament,1885,1922,Kildare South
uk.org.publicwhip/cons/1477,Member of Parliament for Kilkenny North,house-of-commons,Member of Parliament,1885,1922,Kilkenny North
uk.org.publicwhip/cons/1478,Member of Parliament for Kilkenny South,house-of-commons,Member of Parliament,1885,1922,Kilkenny South
uk.org.publicwhip/cons/1479,Member of Parliament for King's County Birr,house-of-commons,Member of Parliament,1885,1918,King's County Birr
uk.org.publicwhip/cons/148,Member of Parliament for Copeland,house-of-commons,Member of Parliament,1983,,Copeland
uk.org.publicwhip/cons/1480,Member of Parliament for King's County Tullamore,house-of-commons,Member of Parliament,1885,1918,King's County Tullamore
uk.org.publicwhip/cons/1481,Member of Parliament for Leitrim North,house-of-commons,Member of Parliament,1885,1918,Leitrim North
uk.org.publicwhip/cons/1482,Member of Parliament for Leitrim South,house-of-commons,Member of Parliament,1885,1918,Leitrim South
uk.org.publicwhip/cons/1483,Member of Parliament for Limerick East,house-of-commons,Member of Parliament,1885,1922,Limerick East
uk.org.publicwhip/cons/1484,Member of Parliament for Londonderry North,house-of-commons,Member of Parliament,1885,1922,Londonderry North
uk.org.publicwhip/cons/1485,Member of Parliament for Londonderry South,house-of-commons,Member of Parliament,1885,1922,Londonderry South
uk.org.publicwhip/cons/1486,Member of Parliament for Longford North,house-of-commons,Member of Parliament,1885,1918,Longford North
uk.org.publicwhip/cons/1487,Member of Parliament for Longford South,house-of-commons,Member of Parliament,1885,1918,Longford South
uk.org.publicwhip/cons/1488,Member of Parliament for County Louth North,house-of-commons,Member of Parliament,1885,1918,County Louth North
uk.org.publicwhip/cons/1489,Member of Parliament for County Louth South,house-of-commons,Member of Parliament,1885,1918,County Louth South
uk.org.publicwhip/cons/149,Member of Parliament for Corby,house-of-commons,Member of Parliament,1983,,Corby
uk.org.publicwhip/cons/1490,Member of Parliament for Mayo East,house-of-commons,Member of Parliament,1885,1922,Mayo East
uk.org.publicwhip/cons/1491,Member of Parliament for Mayo North,house-of-commons,Member of Parliament,1885,1922,Mayo North
uk.org.publicwhip/cons/1492,Member of Parliament for Mayo South,house-of-commons,Member of Parliament,1885,1922,Mayo South
uk.org.publicwhip/cons/1493,Member of Parliament for Mayo West,house-of-commons,Member of Parliament,1885,1922,Mayo West
uk.org.publicwhip/cons/1494,Member of Parliament for Meath North,house-of-commons,Member of Parliament,1885,1922,Meath North
uk.org.publicwhip/cons/1495,Member of Parliament for Meath South,house-of-commons,Member of Parliament,1885,1922,Meath South
uk.org.publicwhip/cons/1496,Member of Parliament for Monaghan North,house-of-commons,Member of Parliament,1885,1922,Monaghan North
uk.org.publicwhip/cons/1497,Member of Parliament for Monaghan South,house-of-commons,Member of Parliament,1885,1922,Monaghan South
uk.org.publicwhip/cons/1498,Member of Parliament for Queen's County Leix,house-of-commons,Member of Parliament,1885,1918,Queen's County Leix
uk.org.publicwhip/cons/1499,Member of Parliament for Queen's County Ossory,house-of-commons,Member of Parliament,1885,1918,Queen's County Ossory
uk.org.publicwhip/cons/15,Member of Parliament for Ashford,house-of-commons,Member of Parliament,1885,,Ashford
uk.org.publicwhip/cons/150,Member of Parliament for Cotswold,house-of-commons,Member of Parliament,1997-05-01,2010-05-05,Cotswold
uk.org.publicwhip/cons/1500,Member of Parliament for Roscommon North,house-of-commons,Member of Parliament,1885,1922,Roscommon North
uk.org.publicwhip/cons/1501,Member of Parliament for Roscommon South,house-of-commons,Member of Parliament,1885,1922,Roscommon South
uk.org.publicwhip/cons/1502,Member of Parliament for Sligo North,house-of-commons,Member of Parliament,1885,1922,Sligo North
uk.org.publicwhip/cons/1503,Member of Parliament for Sligo South,house-of-commons,Member of Parliament,1885,1922,Sligo South
uk.org.publicwhip/cons/1504,Member of Parliament for Tipperary East,house-of-commons,Member of Parliament,1885,1922,Tipperary East
uk.org.publicwhip/cons/1505,Member of Parliament for Tipperary Mid,house-of-commons,Member of Parliament,1885,1922,Tipperary Mid
uk.org.publicwhip/cons/1506,Member of Parliament for Tipperary North,house-of-commons,Member of Parliament,1885,1922,Tipperary North
uk.org.publicwhip/cons/1507,Member of Parliament for Tipperary South,house-of-commons,Member of Parliament,1885,1922,Tipperary South
uk.org.publicwhip/cons/1508,Member of Parliament for Tyrone East,house-of-commons,Member of Parliament,1885,1918,Tyrone East
uk.org.publicwhip/cons/1509,Member of Parliament for Tyrone Mid,house-of-commons,Member of Parliament,1885,1918,Tyrone Mid
uk.org.publicwhip/cons/151,Member of Parliament for Coventry North East,house-of-commons,Member of Parliament,1974,,Coventry North East
uk.org.publicwhip/cons/1510,Member of Parliament for Tyrone North,house-of-commons,Member of Parliament,1885,1918,Tyrone North
uk.org.publicwhip/cons/1511,Member of Parliament for Tyrone North East,house-of-commons,Member of Parliament,1918,1922,Tyrone North East
uk.org.publicwhip/cons/1512,Member of Parliament for Tyrone North West,house-of-commons,Member of Parliament,1918,1922,Tyrone North West
uk.org.publicwhip/cons/1513,Member of Parliament for Tyrone South,house-of-commons,Member of Parliament,1885,1922,Tyrone South
uk.org.publicwhip/cons/1514,Member of Parliament for Waterford East,house-of-commons,Member of Parliament,1885,1918,Waterford East
uk.org.publicwhip/cons/1515,Member of Parliament for Waterford West,house-of-commons,Member of Parliament,1885,1918,Waterford West
uk.org.publicwhip/cons/1516,Member of Parliament for Westmeath North,house-of-commons,Member of Parliament,1885,1918,Westmeath North
uk.org.publicwhip/cons/1517,Member of Parliament for Westmeath South,house-of-commons,Member of Parliament,1885,1918,Westmeath South
uk.org.publicwhip/cons/1518,Member of Parliament for Wexford North,house-of-commons,Member of Parliament,1885,1922,Wexford North
uk.org.publicwhip/cons/1519,Member of Parliament for Wexford South,house-of-commons,Member of Parliament,1885,1922,Wexford South
uk.org.publicwhip/cons/152,Member of Parliament for Coventry North West,house-of-commons,Member of Parliament,1974,,Coventry North West
uk.org.publicwhip/cons/1520,Member of Parliament for Wicklow East,house-of-commons,Member of Parliament,1885,1922,Wicklow East
uk.org.publicwhip/cons/1521,Member of Parliament for Wicklow West,house-of-commons,Member of Parliament,1885,1922,Wicklow West
uk.org.publicwhip/cons/1522,Member of Parliament for National University,house-of-commons,Member of Parliament,1918,1922,National University
uk.org.publicwhip/cons/1523,Member of Parliament for Bexley Sidcup,house-of-commons,Member of Parliament,1974,1997,Bexley Sidcup
uk.org.publicwhip/cons/1524,Member of Parliament for Cirencester and Tewkesbury,house-of-commons,Member of Parliament,1918,1997,Cirencester and Tewkesbury
uk.org.publicwhip/cons/1525,Member of Parliament for New Forest and Christchurch,house-of-commons,Member of Parliament,1918,1950,New Forest and Christchurch
uk.org.publicwhip/cons/1526,Member of Parliament for Barnet,house-of-commons,Member of Parliament,1918,1974,Barnet
uk.org.publicwhip/cons/1527,Member of Parliament for Isle of Ely,house-of-commons,Member of Parliament,1918,1983,Isle of Ely
uk.org.publicwhip/cons/1528,Member of Parliament for Chislehurst,house-of-commons,Member of Parliament,1918,1997,Chislehurst
uk.org.publicwhip/cons/1529,Member of Parliament for Faversham,house-of-commons,Member of Parliament,1885,1997,Faversham
uk.org.publicwhip/cons/153,Member of Parliament for Coventry South,house-of-commons,Member of Parliament,1997-05-01,,Coventry South
uk.org.publicwhip/cons/1530,Member of Parliament for Tonbridge,house-of-commons,Member of Parliament,1910,1974,Tonbridge
uk.org.publicwhip/cons/1531,Member of Parliament for Farnworth,house-of-commons,Member of Parliament,1918,1983,Farnworth
uk.org.publicwhip/cons/1532,Member of Parliament for Heywood and Radcliffe,house-of-commons,Member of Parliament,1918,1950,Heywood and Radcliffe
uk.org.publicwhip/cons/1533,Member of Parliament for Battersea North,house-of-commons,Member of Parliament,1918,1974,Battersea North
uk.org.publicwhip/cons/1534,Member of Parliament for Battersea South,house-of-commons,Member of Parliament,1918,1974,Battersea South
uk.org.publicwhip/cons/1535,Member of Parliament for Bermondsey Rotherhithe,house-of-commons,Member of Parliament,1918,1950,Bermondsey Rotherhithe
uk.org.publicwhip/cons/1536,Member of Parliament for Bermondsey West Bermondsey,house-of-commons,Member of Parliament,1918,1950,Bermondsey West Bermondsey
uk.org.publicwhip/cons/1537,Member of Parliament for Camberwell North West,house-of-commons,Member of Parliament,1918,1950,Camberwell North West
uk.org.publicwhip/cons/1538,Member of Parliament for Fulham East,house-of-commons,Member of Parliament,1918,1955,Fulham East
uk.org.publicwhip/cons/1539,Member of Parliament for Fulham West,house-of-commons,Member of Parliament,1918,1955,Fulham West
uk.org.publicwhip/cons/154,Member of Parliament for Crawley,house-of-commons,Member of Parliament,1983,,Crawley
uk.org.publicwhip/cons/1540,Member of Parliament for Hammersmith North,house-of-commons,Member of Parliament,1918,1983,Hammersmith North
uk.org.publicwhip/cons/1541,Member of Parliament for Holborn,house-of-commons,Member of Parliament,1918,1950,Holborn
uk.org.publicwhip/cons/1542,Member of Parliament for Poplar Bow and Bromley,house-of-commons,Member of Parliament,1918,1950,Poplar Bow and Bromley
uk.org.publicwhip/cons/1543,Member of Parliament for Poplar South Poplar,house-of-commons,Member of Parliament,1918,1950,Poplar South Poplar
uk.org.publicwhip/cons/1544,Member of Parliament for St Pancras South East,house-of-commons,Member of Parliament,1918,1950,St Pancras South East
uk.org.publicwhip/cons/1545,Member of Parliament for St Pancras South West,house-of-commons,Member of Parliament,1918,1950,St Pancras South West
uk.org.publicwhip/cons/1546,Member of Parliament for Southwark Central,house-of-commons,Member of Parliament,1918,1950,Southwark Central
uk.org.publicwhip/cons/1547,Member of Parliament for Southwark North,house-of-commons,Member of Parliament,1918,1950,Southwark North
uk.org.publicwhip/cons/1548,Member of Parliament for Southwark South East,house-of-commons,Member of Parliament,1918,1950,Southwark South East
uk.org.publicwhip/cons/1549,Member of Parliament for Stepney Limehouse,house-of-commons,Member of Parliament,1918,1950,Stepney Limehouse
uk.org.publicwhip/cons/155,Member of Parliament for Crewe and Nantwich,house-of-commons,Member of Parliament,1983,,Crewe and Nantwich
uk.org.publicwhip/cons/1550,Member of Parliament for Stepney Mile End,house-of-commons,Member of Parliament,1918,1950,Stepney Mile End
uk.org.publicwhip/cons/1551,Member of Parliament for Stepney Whitechapel and St George's,house-of-commons,Member of Parliament,1918,1950,Stepney Whitechapel and St George's
uk.org.publicwhip/cons/1552,Member of Parliament for Stoke Newington,house-of-commons,Member of Parliament,1918,1950,Stoke Newington
uk.org.publicwhip/cons/1553,Member of Parliament for Wandsworth Balham and Tooting,house-of-commons,Member of Parliament,1918,1950,Wandsworth Balham and Tooting
uk.org.publicwhip/cons/1554,Member of Parliament for Wandsworth Clapham,house-of-commons,Member of Parliament,1918,1974,Wandsworth Clapham
uk.org.publicwhip/cons/1555,Member of Parliament for Wandsworth Putney,house-of-commons,Member of Parliament,1918,1983,Wandsworth Putney
uk.org.publicwhip/cons/1556,Member of Parliament for Wandsworth Streatham,house-of-commons,Member of Parliament,1918,1974,Wandsworth Streatham
uk.org.publicwhip/cons/1557,Member of Parliament for Westminster Abbey,house-of-commons,Member of Parliament,1918,1950,Westminster Abbey
uk.org.publicwhip/cons/1558,Member of Parliament for Westminster St George's,house-of-commons,Member of Parliament,1918,1950,Westminster St George's
uk.org.publicwhip/cons/1559,Member of Parliament for Woolwich East,house-of-commons,Member of Parliament,1918,1974,Woolwich East
uk.org.publicwhip/cons/156,Member of Parliament for Crosby,house-of-commons,Member of Parliament,1950,2010-05-05,Crosby
uk.org.publicwhip/cons/1560,Member of Parliament for Woolwich West,house-of-commons,Member of Parliament,1918,1974,Woolwich West
uk.org.publicwhip/cons/1561,Member of Parliament for Batley and Morley,house-of-commons,Member of Parliament,1918,1983,Batley and Morley
uk.org.publicwhip/cons/1562,Member of Parliament for Birkenhead East,house-of-commons,Member of Parliament,1918,1950,Birkenhead East
uk.org.publicwhip/cons/1563,Member of Parliament for Birkenhead West,house-of-commons,Member of Parliament,1918,1950,Birkenhead West
uk.org.publicwhip/cons/1564,Member of Parliament for Birmingham Acock's Green,house-of-commons,Member of Parliament,1918,1950,Birmingham Acock's Green
uk.org.publicwhip/cons/1565,Member of Parliament for Birmingham Aston,house-of-commons,Member of Parliament,1918,1974,Birmingham Aston
uk.org.publicwhip/cons/1566,Member of Parliament for Birmingham Deritend,house-of-commons,Member of Parliament,1918,1950,Birmingham Deritend
uk.org.publicwhip/cons/1567,Member of Parliament for Birmingham Duddeston,house-of-commons,Member of Parliament,1918,1950,Birmingham Duddeston
uk.org.publicwhip/cons/1568,Member of Parliament for Birmingham Handsworth,house-of-commons,Member of Parliament,1918,1983,Birmingham Handsworth
uk.org.publicwhip/cons/1569,Member of Parliament for Birmingham King's Norton,house-of-commons,Member of Parliament,1918,1974,Birmingham King's Norton
uk.org.publicwhip/cons/157,Member of Parliament for Croydon Central,house-of-commons,Member of Parliament,1974,,Croydon Central
uk.org.publicwhip/cons/1570,Member of Parliament for Birmingham Moseley,house-of-commons,Member of Parliament,1918,1950,Birmingham Moseley
uk.org.publicwhip/cons/1571,Member of Parliament for Birmingham Sparkbrook,house-of-commons,Member of Parliament,1918,1997,Birmingham Sparkbrook
uk.org.publicwhip/cons/1572,Member of Parliament for Blackpool North,house-of-commons,Member of Parliament,1945,1997,Blackpool North
uk.org.publicwhip/cons/1573,Member of Parliament for Bournemouth,house-of-commons,Member of Parliament,1918,1950,Bournemouth
uk.org.publicwhip/cons/1574,Member of Parliament for Bristol Central,house-of-commons,Member of Parliament,1918,1974,Bristol Central
uk.org.publicwhip/cons/1575,Member of Parliament for Bromley,house-of-commons,Member of Parliament,1918,1974,Bromley
uk.org.publicwhip/cons/1576,Member of Parliament for Coventry East,house-of-commons,Member of Parliament,1945,1974,Coventry East
uk.org.publicwhip/cons/1577,Member of Parliament for Coventry West,house-of-commons,Member of Parliament,1945,1950,Coventry West
uk.org.publicwhip/cons/1578,Member of Parliament for Ealing East,house-of-commons,Member of Parliament,1945,1950,Ealing East
uk.org.publicwhip/cons/1579,Member of Parliament for Ealing West,house-of-commons,Member of Parliament,1945,1950,Ealing West
uk.org.publicwhip/cons/158,Member of Parliament for Croydon North,house-of-commons,Member of Parliament,1997-05-01,,Croydon North
uk.org.publicwhip/cons/1580,Member of Parliament for East Ham North,house-of-commons,Member of Parliament,1918,1974,East Ham North
uk.org.publicwhip/cons/1581,Member of Parliament for East Ham South,house-of-commons,Member of Parliament,1918,1974,East Ham South
uk.org.publicwhip/cons/1582,Member of Parliament for Grimsby,house-of-commons,Member of Parliament,1918,1983,Grimsby
uk.org.publicwhip/cons/1583,Member of Parliament for Hendon North,house-of-commons,Member of Parliament,1945,1974,Hendon North
uk.org.publicwhip/cons/1584,Member of Parliament for Hendon South,house-of-commons,Member of Parliament,1945,1974,Hendon South
uk.org.publicwhip/cons/1585,Member of Parliament for Heston and Isleworth,house-of-commons,Member of Parliament,1918,1974,Heston and Isleworth
uk.org.publicwhip/cons/1586,Member of Parliament for Ilford,house-of-commons,Member of Parliament,1918,1950,Ilford
uk.org.publicwhip/cons/1587,Member of Parliament for Kingston upon Hull North West,house-of-commons,Member of Parliament,1918,1950,Kingston upon Hull North West
uk.org.publicwhip/cons/1588,Member of Parliament for Kingston upon Hull South West,house-of-commons,Member of Parliament,1918,1950,Kingston upon Hull South West
uk.org.publicwhip/cons/1589,Member of Parliament for Kingston upon Thames,house-of-commons,Member of Parliament,1918,1997,Kingston upon Thames
uk.org.publicwhip/cons/159,Member of Parliament for Croydon South,house-of-commons,Member of Parliament,1955,,Croydon South
uk.org.publicwhip/cons/1590,Member of Parliament for Leeds South East,house-of-commons,Member of Parliament,1918,1983,Leeds South East
uk.org.publicwhip/cons/1591,Member of Parliament for Leyton East,house-of-commons,Member of Parliament,1918,1950,Leyton East
uk.org.publicwhip/cons/1592,Member of Parliament for Leyton West,house-of-commons,Member of Parliament,1918,1950,Leyton West
uk.org.publicwhip/cons/1593,Member of Parliament for Liverpool Edge Hill,house-of-commons,Member of Parliament,1918,1983,Liverpool Edge Hill
uk.org.publicwhip/cons/1594,Member of Parliament for Liverpool Fairfield,house-of-commons,Member of Parliament,1918,1950,Liverpool Fairfield
uk.org.publicwhip/cons/1595,Member of Parliament for Manchester Ardwick,house-of-commons,Member of Parliament,1918,1983,Manchester Ardwick
uk.org.publicwhip/cons/1596,Member of Parliament for Manchester Clayton,house-of-commons,Member of Parliament,1918,1955,Manchester Clayton
uk.org.publicwhip/cons/1597,Member of Parliament for Manchester Exchange,house-of-commons,Member of Parliament,1918,1974,Manchester Exchange
uk.org.publicwhip/cons/1598,Member of Parliament for Manchester Hulme,house-of-commons,Member of Parliament,1918,1950,Manchester Hulme
uk.org.publicwhip/cons/1599,Member of Parliament for Manchester Platting,house-of-commons,Member of Parliament,1918,1950,Manchester Platting
uk.org.publicwhip/cons/16,Member of Parliament for Ashton-under-Lyne,house-of-commons,Member of Parliament,1832,,Ashton-under-Lyne
uk.org.publicwhip/cons/160,Member of Parliament for Cumbernauld and Kilsyth,house-of-commons,Member of Parliament,1983,2005-05-04,Cumbernauld and Kilsyth
uk.org.publicwhip/cons/1600,Member of Parliament for Manchester Rusholme,house-of-commons,Member of Parliament,1918,1950,Manchester Rusholme
