id,label,organization_id,role,start_date,end_date,area_name
uk.org.publicwhip/cons/1944,Member of Parliament for Tower Hamlets Bethnal Green and Bow,house-of-commons,Member of Parliament,1974,1983,Tower Hamlets Bethnal Green and Bow
uk.org.publicwhip/cons/1945,Member of Parliament for Tower Hamlets Stepney and Poplar,house-of-commons,Member of Parliament,1974,1983,Tower Hamlets Stepney and Poplar
uk.org.publicwhip/cons/1946,Member of Parliament for Waltham Forest Chingford,house-of-commons,Member of Parliament,1974,1983,Waltham Forest Chingford
uk.org.publicwhip/cons/1947,Member of Parliament for Waltham Forest Walthamstow,house-of-commons,Member of Parliament,1974,1983,Waltham Forest Walthamstow
uk.org.publicwhip/cons/1948,Member of Parliament for Wandsworth Battersea North,house-of-commons,Member of Parliament,1974,1983,Wandsworth Battersea North
uk.org.publicwhip/cons/1949,Member of Parliament for Wandsworth Battersea South,house-of-commons,Member of Parliament,1974,1983,Wandsworth Battersea South
uk.org.publicwhip/cons/195,Member of Parliament for East Hampshire,house-of-commons,Member of Parliament,1983,,East Hampshire
uk.org.publicwhip/cons/1950,Member of Parliament for Wandsworth Tooting,house-of-commons,Member of Parliament,1974,1983,Wandsworth Tooting
uk.org.publicwhip/cons/1951,Member of Parliament for Warley East,house-of-commons,Member of Parliament,1974,1997,Warley East
uk.org.publicwhip/cons/1952,Member of Parliament for Warley West,house-of-commons,Member of Parliament,1974,1997,Warley West
uk.org.publicwhip/cons/1953,Member of Parliament for Welwyn and Hatfield,house-of-commons,Member of Parliament,1974,1983,Welwyn and Hatfield
uk.org.publicwhip/cons/1954,Member of Parliament for Windsor and Maidenhead,house-of-commons,Member of Parliament,1974,1997,Windsor and Maidenhead
uk.org.publicwhip/cons/1955,Member of Parliament for Angus East,house-of-commons,Member of Parliament,1983,1997,Angus East
uk.org.publicwhip/cons/1956,Member of Parliament for Berkshire East,house-of-commons,Member of Parliament,1983,1997,Berkshire East
uk.org.publicwhip/cons/1957,Member of Parliament for Bethnal Green and Stepney,house-of-commons,Member of Parliament,1983,1997,Bethnal Green and Stepney
uk.org.publicwhip/cons/1958,Member of Parliament for Bexleyheath,house-of-commons,Member of Parliament,1983,1997,Bexleyheath
uk.org.publicwhip/cons/1959,Member of Parliament for Booth Ferry,house-of-commons,Member of Parliament,1983,1997,Booth Ferry
uk.org.publicwhip/cons/196,Member of Parliament for East Kilbride,house-of-commons,Member of Parliament,1974,2005-05-04,East Kilbride
uk.org.publicwhip/cons/1960,Member of Parliament for Bow and Poplar,house-of-commons,Member of Parliament,1983,1997,Bow and Poplar
uk.org.publicwhip/cons/1961,Member of Parliament for Brigg and Cleethorpes,house-of-commons,Member of Parliament,1983,1997,Brigg and Cleethorpes
uk.org.publicwhip/cons/1962,Member of Parliament for Cambridge South West,house-of-commons,Member of Parliament,1983,1997,Cambridge South West
uk.org.publicwhip/cons/1963,Member of Parliament for Cannock and Burntwood,house-of-commons,Member of Parliament,1983,1997,Cannock and Burntwood
uk.org.publicwhip/cons/1964,Member of Parliament for Ceredigion and Pembroke North,house-of-commons,Member of Parliament,1983,1997,Ceredigion and Pembroke North
uk.org.publicwhip/cons/1965,Member of Parliament for Chingford,house-of-commons,Member of Parliament,1983,1997,Chingford
uk.org.publicwhip/cons/1966,Member of Parliament for Clackmannan,house-of-commons,Member of Parliament,1983,1997,Clackmannan
uk.org.publicwhip/cons/1967,Member of Parliament for Clwyd North West,house-of-commons,Member of Parliament,1983,1997,Clwyd North West
uk.org.publicwhip/cons/1968,Member of Parliament for Clwyd South West,house-of-commons,Member of Parliament,1983,1997,Clwyd South West
uk.org.publicwhip/cons/1969,Member of Parliament for Colchester North,house-of-commons,Member of Parliament,1983,1997,Colchester North
uk.org.publicwhip/cons/197,Member of Parliament for East Londonderry,house-of-commons,Member of Parliament,1983,,East Londonderry
uk.org.publicwhip/cons/197-NI,MLA for East Londonderry,northern-ireland-assembly,MLA,,,East Londonderry
uk.org.publicwhip/cons/1970,Member of Parliament for Colchester South and Maldon,house-of-commons,Member of Parliament,1983,1997,Colchester South and Maldon
uk.org.publicwhip/cons/1971,Member of Parliament for Davyhulme,house-of-commons,Member of Parliament,1983,1997,Davyhulme
uk.org.publicwhip/cons/1972,Member of Parliament for Dulwich,house-of-commons,Member of Parliament,1983,1997,Dulwich
uk.org.publicwhip/cons/1973,Member of Parliament for Gainsborough and Horncastle,house-of-commons,Member of Parliament,1983,1997,Gainsborough and Horncastle
uk.org.publicwhip/cons/1974,Member of Parliament for Glanford and Scunthorpe,house-of-commons,Member of Parliament,1983,1997,Glanford and Scunthorpe
uk.org.publicwhip/cons/1975,Member of Parliament for Hertfordshire North,house-of-commons,Member of Parliament,1983,1997,Hertfordshire North
uk.org.publicwhip/cons/1976,Member of Parliament for Hertfordshire West,house-of-commons,Member of Parliament,1983,1997,Hertfordshire West
uk.org.publicwhip/cons/1977,Member of Parliament for Houghton and Washington,house-of-commons,Member of Parliament,1983,1997,Houghton and Washington
uk.org.publicwhip/cons/1978,"Member of Parliament for Inverness, Nairn and Lochaber",house-of-commons,Member of Parliament,1983,1997,"Inverness, Nairn and Lochaber"
uk.org.publicwhip/cons/1979,Member of Parliament for Knowsley North,house-of-commons,Member of Parliament,1983,1997,Knowsley North
uk.org.publicwhip/cons/198,Member of Parliament for East Lothian,house-of-commons,Member of Parliament,1983,,East Lothian
uk.org.publicwhip/cons/1980,Member of Parliament for Leeds South and Morley,house-of-commons,Member of Parliament,1983,1997,Leeds South and Morley
uk.org.publicwhip/cons/1981,Member of Parliament for Linsey East,house-of-commons,Member of Parliament,1983,1997,Linsey East
uk.org.publicwhip/cons/1982,Member of Parliament for Liverpool Broadgreen,house-of-commons,Member of Parliament,1983,1997,Liverpool Broadgreen
uk.org.publicwhip/cons/1983,Member of Parliament for Liverpool Mossley Hill,house-of-commons,Member of Parliament,1983,1997,Liverpool Mossley Hill
uk.org.publicwhip/cons/1984,Member of Parliament for Milton Keynes,house-of-commons,Member of Parliament,1983,1992,Milton Keynes
uk.org.publicwhip/cons/1985,Member of Parliament for Monklands West,house-of-commons,Member of Parliament,1983,1997,Monklands West
uk.org.publicwhip/cons/1986,Member of Parliament for Montgomery,house-of-commons,Member of Parliament,1974,1997,Montgomery
uk.org.publicwhip/cons/1987,Member of Parliament for Motherwell North,house-of-commons,Member of Parliament,1983,1997,Motherwell North
uk.org.publicwhip/cons/1988,Member of Parliament for Motherwell South,house-of-commons,Member of Parliament,1983,1997,Motherwell South
uk.org.publicwhip/cons/1989,Member of Parliament for Norwood,house-of-commons,Member of Parliament,1983,1997,Norwood
uk.org.publicwhip/cons/199,Member of Parliament for East Surrey,house-of-commons,Member of Parliament,1950,,East Surrey
uk.org.publicwhip/cons/1990,Member of Parliament for Oldham Central and Royton,house-of-commons,Member of Parliament,1983,1997,Oldham Central and Royton
uk.org.publicwhip/cons/1991,Member of Parliament for Peckham,house-of-commons,Member of Parliament,1983,1997,Peckham
uk.org.publicwhip/cons/1992,Member of Parliament for Ravensbourne,house-of-commons,Member of Parliament,1983,1997,Ravensbourne
uk.org.publicwhip/cons/1993,Member of Parliament for Renfrew West and Inverclyde,house-of-commons,Member of Parliament,1983,1997,Renfrew West and Inverclyde
uk.org.publicwhip/cons/1994,Member of Parliament for Richmond and Barnes,house-of-commons,Member of Parliament,1983,1997,Richmond and Barnes
uk.org.publicwhip/cons/1995,Member of Parliament for Rochford,house-of-commons,Member of Parliament,1983,1997,Rochford
uk.org.publicwhip/cons/1996,Member of Parliament for Romsey and Waterside,house-of-commons,Member of Parliament,1983,1997,Romsey and Waterside
uk.org.publicwhip/cons/1997,Member of Parliament for Ross and Cromarty and Skye,house-of-commons,Member of Parliament,1983,1997,Ross and Cromarty and Skye
uk.org.publicwhip/cons/1998,Member of Parliament for South Hams,house-of-commons,Member of Parliament,1983,1997,South Hams
uk.org.publicwhip/cons/1999,Member of Parliament for South Ribble,house-of-commons,Member of Parliament,1983,1997,South Ribble
uk.org.publicwhip/cons/2,Member of Parliament for Aberdeen Central,house-of-commons,Member of Parliament,1997-05-01,2005-05-04,Aberdeen Central
uk.org.publicwhip/cons/20,Member of Parliament for Banff and Buchan,house-of-commons,Member of Parliament,1983,,Banff and Buchan
uk.org.publicwhip/cons/200,Member of Parliament for East Worthing and Shoreham,house-of-commons,Member of Parliament,1997-05-01,,East Worthing and Shoreham
uk.org.publicwhip/cons/2000,Member of Parliament for Southwark and Bermondsey,house-of-commons,Member of Parliament,1983,1997,Southwark and Bermondsey
uk.org.publicwhip/cons/2001,Member of Parliament for Staffordshire Mid,house-of-commons,Member of Parliament,1983,1997,Staffordshire Mid
uk.org.publicwhip/cons/2002,Member of Parliament for Stamford and Spalding,house-of-commons,Member of Parliament,1983,1997,Stamford and Spalding
uk.org.publicwhip/cons/2003,Member of Parliament for Suffolk Central,house-of-commons,Member of Parliament,1983,1997,Suffolk Central
uk.org.publicwhip/cons/2004,Member of Parliament for Westminster North,house-of-commons,Member of Parliament,1983,1997,Westminster North
uk.org.publicwhip/cons/2005,Member of Parliament for Wyre,house-of-commons,Member of Parliament,1983,1997,Wyre
uk.org.publicwhip/cons/2006,Member of Parliament for County Carlow,house-of-commons,Member of Parliament,1802,1922,County Carlow
uk.org.publicwhip/cons/2007,Member of Parliament for Cavan West,house-of-commons,Member of Parliament,1885,1922,Cavan West
uk.org.publicwhip/cons/2008,Member of Parliament for Newport (Shropshire),house-of-commons,Member of Parliament,1885,1918,Newport (Shropshire)
uk.org.publicwhip/cons/2009,Member of Parliament for Newport (Isle of Wight),house-of-commons,Member of Parliament,1660,1885,Newport (Isle of Wight)
uk.org.publicwhip/cons/201,Member of Parliament for East Yorkshire,house-of-commons,Member of Parliament,1997-05-01,,East Yorkshire
uk.org.publicwhip/cons/2010,Member of Parliament for Plymouth Drake,house-of-commons,Member of Parliament,1974,1997,Plymouth Drake
uk.org.publicwhip/cons/2011,Member of Parliament for Kent Mid,house-of-commons,Member of Parliament,1983,1997,Kent Mid
uk.org.publicwhip/cons/2012,Member of Parliament for Woolwich,house-of-commons,Member of Parliament,1983,1997,Woolwich
uk.org.publicwhip/cons/2013,Member of Parliament for County Louth,house-of-commons,Member of Parliament,1801,1885,County Louth
uk.org.publicwhip/cons/2014,Member of Parliament for Horsham,house-of-commons,Member of Parliament,1945,1974,Horsham
uk.org.publicwhip/cons/2015,Member of Parliament for Kingston upon Hull West,house-of-commons,Member of Parliament,1885,1918,Kingston upon Hull West
uk.org.publicwhip/cons/2016,Member of Parliament for West Ham South,house-of-commons,Member of Parliament,1885,1918,West Ham South
uk.org.publicwhip/cons/2017,Member of Parliament for Honiton,house-of-commons,Member of Parliament,1885,1997,Honiton
uk.org.publicwhip/cons/2018,Member of Parliament for Lanarkshire Northern,house-of-commons,Member of Parliament,1918,1950,Lanarkshire Northern
uk.org.publicwhip/cons/2019,Member of Parliament for Norfolk Eastern,house-of-commons,Member of Parliament,1885,1950,Norfolk Eastern
uk.org.publicwhip/cons/202,Member of Parliament for Eastbourne,house-of-commons,Member of Parliament,1885,,Eastbourne
uk.org.publicwhip/cons/2020,Member of Parliament for Beverley,house-of-commons,Member of Parliament,1950,1955,Beverley
uk.org.publicwhip/cons/2021,Member of Parliament for Beverley,house-of-commons,Member of Parliament,1983,1997,Beverley
uk.org.publicwhip/cons/2022,Member of Parliament for Westmorland,house-of-commons,Member of Parliament,1918,1983,Westmorland
uk.org.publicwhip/cons/2023,Member of Parliament for Down,house-of-commons,Member of Parliament,1922,1950,Down
uk.org.publicwhip/cons/2024,Member of Parliament for Huntingdonshire,house-of-commons,Member of Parliament,1660,1885,Huntingdonshire
uk.org.publicwhip/cons/2025,Member of Parliament for Belfast North,house-of-commons,Member of Parliament,1885,1918,Belfast North
uk.org.publicwhip/cons/2026,Member of Parliament for Merthyr Tydfil,house-of-commons,Member of Parliament,1950,1983,Merthyr Tydfil
uk.org.publicwhip/cons/2027,Member of Parliament for Lancaster,house-of-commons,Member of Parliament,1660,1866,Lancaster
uk.org.publicwhip/cons/2028,Member of Parliament for Hammersmith,house-of-commons,Member of Parliament,1983,1997,Hammersmith
uk.org.publicwhip/cons/2029,Member of Parliament for County Londonderry,house-of-commons,Member of Parliament,1922,1983,County Londonderry
uk.org.publicwhip/cons/203,Member of Parliament for Eastleigh,house-of-commons,Member of Parliament,1950,,Eastleigh
uk.org.publicwhip/cons/2030,Member of Parliament for Tottenham,house-of-commons,Member of Parliament,1950,1974,Tottenham
uk.org.publicwhip/cons/2031,Member of Parliament for County Armagh,house-of-commons,Member of Parliament,1922,1983,County Armagh
uk.org.publicwhip/cons/2032,Member of Parliament for Hendon North,house-of-commons,Member of Parliament,1983,1997,Hendon North
uk.org.publicwhip/cons/2033,Member of Parliament for Westmeath,house-of-commons,Member of Parliament,1918,1922,Westmeath
uk.org.publicwhip/cons/2034,Member of Parliament for King's County,house-of-commons,Member of Parliament,1918,1922,King's County
uk.org.publicwhip/cons/2035,Member of Parliament for Leitrim,house-of-commons,Member of Parliament,1918,1922,Leitrim
uk.org.publicwhip/cons/2036,Member of Parliament for Longford,house-of-commons,Member of Parliament,1918,1922,Longford
uk.org.publicwhip/cons/2037,Member of Parliament for County Louth,house-of-commons,Member of Parliament,1918,1922,County Louth
uk.org.publicwhip/cons/2038,Member of Parliament for Queen's County,house-of-commons,Member of Parliament,1918,1922,Queen's County
uk.org.publicwhip/cons/2039,Member of Parliament for Antrim,house-of-commons,Member of Parliament,1922,1950,Antrim
uk.org.publicwhip/cons/204,Member of Parliament for East Renfrewshire,house-of-commons,Member of Parliament,1983,,East Renfrewshire
uk.org.publicwhip/cons/2040,Member of Parliament for Arundel,house-of-commons,Member of Parliament,1974,1997,Arundel
uk.org.publicwhip/cons/2041,Member of Parliament for Sudbury,house-of-commons,Member of Parliament,1660,1844,Sudbury
uk.org.publicwhip/cons/2042,Member of Parliament for Reigate,house-of-commons,Member of Parliament,1885,1974,Reigate
uk.org.publicwhip/cons/2043,Member of Parliament for Shoreham,house-of-commons,Member of Parliament,1974,1997,Shoreham
uk.org.publicwhip/cons/2044,Member of Parliament for Wanstead and Woodford,house-of-commons,Member of Parliament,1983,1997,Wanstead and Woodford
uk.org.publicwhip/cons/2045,Member of Parliament for Fulham,house-of-commons,Member of Parliament,1983,1997,Fulham
uk.org.publicwhip/cons/2046,Member of Parliament for Kingston upon Hull Central,house-of-commons,Member of Parliament,1974,1983,Kingston upon Hull Central
uk.org.publicwhip/cons/2047,Member of Parliament for Southwark Bermondsey,house-of-commons,Member of Parliament,1974,1983,Southwark Bermondsey
uk.org.publicwhip/cons/2048,Member of Parliament for Southwark,house-of-commons,Member of Parliament,1950,1974,Southwark
uk.org.publicwhip/cons/2049,Member of Parliament for Scarborough,house-of-commons,Member of Parliament,1974,1997,Scarborough
uk.org.publicwhip/cons/205,Member of Parliament for Eccles,house-of-commons,Member of Parliament,1885,2010-05-05,Eccles
uk.org.publicwhip/cons/2050,Member of Parliament for New Forest,house-of-commons,Member of Parliament,1950,1997,New Forest
uk.org.publicwhip/cons/2051,Member of Parliament for Wellington (Shropshire),house-of-commons,Member of Parliament,1885,1918,Wellington (Shropshire)
uk.org.publicwhip/cons/2052,Member of Parliament for Hendon South,house-of-commons,Member of Parliament,1983,1997,Hendon South
uk.org.publicwhip/cons/2053,Member of Parliament for Truro,house-of-commons,Member of Parliament,1950,1997,Truro
uk.org.publicwhip/cons/2054,Member of Parliament for West Ham North,house-of-commons,Member of Parliament,1950,1974,West Ham North
uk.org.publicwhip/cons/2055,Member of Parliament for Erith and Crayford,house-of-commons,Member of Parliament,1983,1997,Erith and Crayford
uk.org.publicwhip/cons/2056,Member of Parliament for Reading,house-of-commons,Member of Parliament,1955,1974,Reading
uk.org.publicwhip/cons/2057,Member of Parliament for Reading North,house-of-commons,Member of Parliament,1974,1983,Reading North
uk.org.publicwhip/cons/2058,Member of Parliament for Reading South,house-of-commons,Member of Parliament,1974,1983,Reading South
uk.org.publicwhip/cons/2059,Member of Parliament for Bridgwater,house-of-commons,Member of Parliament,1660,1870,Bridgwater
uk.org.publicwhip/cons/206,Member of Parliament for Eddisbury,house-of-commons,Member of Parliament,1983,,Eddisbury
uk.org.publicwhip/cons/2060,Member of Parliament for Surbiton,house-of-commons,Member of Parliament,1983,1997,Surbiton
uk.org.publicwhip/cons/2061,Member of Parliament for Nottingham West,house-of-commons,Member of Parliament,1955,1983,Nottingham West
uk.org.publicwhip/cons/2062,Member of Parliament for Caernarvonshire,house-of-commons,Member of Parliament,1918,1950,Caernarvonshire
uk.org.publicwhip/cons/2063,Member of Parliament for Chelsea,house-of-commons,Member of Parliament,1983,1997,Chelsea
uk.org.publicwhip/cons/2064,Member of Parliament for Totnes,house-of-commons,Member of Parliament,1660,1868,Totnes
uk.org.publicwhip/cons/2065,Member of Parliament for Redbridge Ilford South,house-of-commons,Member of Parliament,1974,1983,Redbridge Ilford South
uk.org.publicwhip/cons/2066,Member of Parliament for Pudsey,house-of-commons,Member of Parliament,1885,1918,Pudsey
uk.org.publicwhip/cons/2067,Member of Parliament for Bucklow,house-of-commons,Member of Parliament,1945,1950,Bucklow
uk.org.publicwhip/cons/2068,Member of Parliament for Bromley Orpington,house-of-commons,Member of Parliament,1974,1983,Bromley Orpington
uk.org.publicwhip/cons/2069,Member of Parliament for Bedfordshire North,house-of-commons,Member of Parliament,1983,1997,Bedfordshire North
uk.org.publicwhip/cons/207,Member of Parliament for Edinburgh Central,house-of-commons,Member of Parliament,1885,2005-05-04,Edinburgh Central
uk.org.publicwhip/cons/2070,Member of Parliament for Fulham,house-of-commons,Member of Parliament,1955,1974,Fulham
uk.org.publicwhip/cons/2071,Member of Parliament for Chertsey and Walton,house-of-commons,Member of Parliament,1974,1997,Chertsey and Walton
uk.org.publicwhip/cons/2072,Member of Parliament for Dublin St Michan's,house-of-commons,Member of Parliament,1918,1922,Dublin St Michan's
uk.org.publicwhip/cons/2073,Member of Parliament for Aldeburgh,house-of-commons,Member of Parliament,1660,1832,Aldeburgh
uk.org.publicwhip/cons/2074,Member of Parliament for Amersham,house-of-commons,Member of Parliament,1660,1832,Amersham
uk.org.publicwhip/cons/2075,Member of Parliament for Aldborough,house-of-commons,Member of Parliament,1660,1832,Aldborough
uk.org.publicwhip/cons/2076,Member of Parliament for Appleby,house-of-commons,Member of Parliament,1660,1832,Appleby
uk.org.publicwhip/cons/2077,Member of Parliament for Anstruther Easter Burghs,house-of-commons,Member of Parliament,1708,1832,Anstruther Easter Burghs
uk.org.publicwhip/cons/2078,Member of Parliament for Bere Alston,house-of-commons,Member of Parliament,1660,1832,Bere Alston
uk.org.publicwhip/cons/2079,Member of Parliament for Bletchingley,house-of-commons,Member of Parliament,1660,1832,Bletchingley
uk.org.publicwhip/cons/208,Member of Parliament for Edinburgh East and Musselburgh,house-of-commons,Member of Parliament,1997-05-01,2005-05-04,Edinburgh East and Musselburgh
uk.org.publicwhip/cons/2080,Member of Parliament for Bishop's Castle,house-of-commons,Member of Parliament,1660,1832,Bishop's Castle
uk.org.publicwhip/cons/2081,Member of Parliament for Boroughbridge,house-of-commons,Member of Parliament,1660,1832,Boroughbridge
uk.org.publicwhip/cons/2082,Member of Parliament for Brackley,house-of-commons,Member of Parliament,1661,1832,Brackley
uk.org.publicwhip/cons/2083,Member of Parliament for Bossiney,house-of-commons,Member of Parliament,1660,1832,Bossiney
uk.org.publicwhip/cons/2084,Member of Parliament for Bramber,house-of-commons,Member of Parliament,1660,1832,Bramber
uk.org.publicwhip/cons/2085,Member of Parliament for Buteshire and Caithness,house-of-commons,Member of Parliament,1708,1832,Buteshire and Caithness
uk.org.publicwhip/cons/2086,Member of Parliament for Callington,house-of-commons,Member of Parliament,1660,1832,Callington
uk.org.publicwhip/cons/2087,Member of Parliament for Camelford,house-of-commons,Member of Parliament,1660,1832,Camelford
uk.org.publicwhip/cons/2088,Member of Parliament for Cheshire,house-of-commons,Member of Parliament,1660,1832,Cheshire
uk.org.publicwhip/cons/2089,Member of Parliament for Castle Rising,house-of-commons,Member of Parliament,1660,1832,Castle Rising
uk.org.publicwhip/cons/209,Member of Parliament for Edinburgh North and Leith,house-of-commons,Member of Parliament,1997-05-01,,Edinburgh North and Leith
uk.org.publicwhip/cons/2090,Member of Parliament for Corfe Castle,house-of-commons,Member of Parliament,1677,1832,Corfe Castle
uk.org.publicwhip/cons/2091,Member of Parliament for Cornwall,house-of-commons,Member of Parliament,1660,1832,Cornwall
uk.org.publicwhip/cons/2092,Member of Parliament for Cumberland,house-of-commons,Member of Parliament,1660,1832,Cumberland
uk.org.publicwhip/cons/2093,Member of Parliament for Cromartyshire and Nairnshire,house-of-commons,Member of Parliament,1708,1832,Cromartyshire and Nairnshire
uk.org.publicwhip/cons/2094,Member of Parliament for Derbyshire,house-of-commons,Member of Parliament,1660,1832,Derbyshire
uk.org.publicwhip/cons/2095,Member of Parliament for Devonshire,house-of-commons,Member of Parliament,1660,1832,Devonshire
uk.org.publicwhip/cons/2096,Member of Parliament for Downton,house-of-commons,Member of Parliament,1660,1832,Downton
uk.org.publicwhip/cons/2097,Member of Parliament for Durham County,house-of-commons,Member of Parliament,1675,1832,Durham County
uk.org.publicwhip/cons/2098,Member of Parliament for Dysart Burghs,house-of-commons,Member of Parliament,1708,1832,Dysart Burghs
uk.org.publicwhip/cons/2099,Member of Parliament for Dunwich,house-of-commons,Member of Parliament,1660,1832,Dunwich
uk.org.publicwhip/cons/21,Member of Parliament for Barking,house-of-commons,Member of Parliament,1918,,Barking
uk.org.publicwhip/cons/210,Member of Parliament for Edinburgh South,house-of-commons,Member of Parliament,1885,,Edinburgh South
uk.org.publicwhip/cons/2100,Member of Parliament for East Grinstead,house-of-commons,Member of Parliament,1660,1832,East Grinstead
uk.org.publicwhip/cons/2101,Member of Parliament for East Looe,house-of-commons,Member of Parliament,1660,1832,East Looe
uk.org.publicwhip/cons/2102,Member of Parliament for Elginshire,house-of-commons,Member of Parliament,1708,1832,Elginshire
uk.org.publicwhip/cons/2103,Member of Parliament for Essex,house-of-commons,Member of Parliament,1660,1832,Essex
uk.org.publicwhip/cons/2104,Member of Parliament for Fowey,house-of-commons,Member of Parliament,1661,1832,Fowey
uk.org.publicwhip/cons/2105,Member of Parliament for Gatton,house-of-commons,Member of Parliament,1660,1832,Gatton
uk.org.publicwhip/cons/2106,Member of Parliament for Gloucestershire,house-of-commons,Member of Parliament,1660,1832,Gloucestershire
uk.org.publicwhip/cons/2107,Member of Parliament for Grampound,house-of-commons,Member of Parliament,1660,1821,Grampound
uk.org.publicwhip/cons/2108,Member of Parliament for Great Bedwyn,house-of-commons,Member of Parliament,1660,1832,Great Bedwyn
uk.org.publicwhip/cons/2109,Member of Parliament for Hampshire,house-of-commons,Member of Parliament,1660,1832,Hampshire
uk.org.publicwhip/cons/211,Member of Parliament for Edinburgh West,house-of-commons,Member of Parliament,1885,,Edinburgh West
uk.org.publicwhip/cons/2110,Member of Parliament for Hedon,house-of-commons,Member of Parliament,1660,1832,Hedon
uk.org.publicwhip/cons/2111,Member of Parliament for Haslemere,house-of-commons,Member of Parliament,1660,1832,Haslemere
uk.org.publicwhip/cons/2112,Member of Parliament for Higham Ferrers,house-of-commons,Member of Parliament,1660,1832,Higham Ferrers
uk.org.publicwhip/cons/2113,Member of Parliament for Hindon,house-of-commons,Member of Parliament,1660,1832,Hindon
uk.org.publicwhip/cons/2114,Member of Parliament for Heytesbury,house-of-commons,Member of Parliament,1660,1832,Heytesbury
uk.org.publicwhip/cons/2115,Member of Parliament for Ilchester,house-of-commons,Member of Parliament,1660,1832,Ilchester
uk.org.publicwhip/cons/2116,Member of Parliament for Kent,house-of-commons,Member of Parliament,1660,1832,Kent
uk.org.publicwhip/cons/2117,Member of Parliament for Lanark,house-of-commons,Member of Parliament,1708,1832,Lanark
uk.org.publicwhip/cons/2118,Member of Parliament for Lancashire,house-of-commons,Member of Parliament,1660,1832,Lancashire
uk.org.publicwhip/cons/2119,Member of Parliament for Leicestershire,house-of-commons,Member of Parliament,1660,1832,Leicestershire
uk.org.publicwhip/cons/212,Member of Parliament for Edinburgh Pentlands,house-of-commons,Member of Parliament,1950,2005-05-04,Edinburgh Pentlands
