id,label,organization_id,role,start_date,end_date,area_name
uk.org.publicwhip/cons/1,Member of Parliament for Aberavon,house-of-commons,Member of Parliament,1918,,Aberavon
uk.org.publicwhip/cons/10,Member of Parliament for Amber Valley,house-of-commons,Member of Parliament,1983,,Amber Valley
uk.org.publicwhip/cons/100,Member of Parliament for Burton,house-of-commons,Member of Parliament,1885,,Burton
uk.org.publicwhip/cons/1000,Member of Parliament for Lancashire Southern,house-of-commons,Member of Parliament,1832,1868,Lancashire Southern
uk.org.publicwhip/cons/1001,Member of Parliament for Lancashire South Eastern,house-of-commons,Member of Parliament,1868,1885,Lancashire South Eastern
uk.org.publicwhip/cons/1002,Member of Parliament for Lancashire South Western,house-of-commons,Member of Parliament,1868,1885,Lancashire South Western
uk.org.publicwhip/cons/1003,Member of Parliament for Leicestershire Northern,house-of-commons,Member of Parliament,1832,1885,Leicestershire Northern
uk.org.publicwhip/cons/1004,Member of Parliament for Leicestershire Southern,house-of-commons,Member of Parliament,1832,1885,Leicestershire Southern
uk.org.publicwhip/cons/1005,"Member of Parliament for Lincolnshire, parts of Kesteven and Holland",house-of-commons,Member of Parliament,1832,1868,"Lincolnshire, parts of Kesteven and Holland"
uk.org.publicwhip/cons/1006,"Member of Parliament for Lincolnshire, parts of Lindsey",house-of-commons,Member of Parliament,1832,1868,"Lincolnshire, parts of Lindsey"
uk.org.publicwhip/cons/1007,Member of Parliament for Lincolnshire Mid,house-of-commons,Member of Parliament,1868,1885,Lincolnshire Mid
uk.org.publicwhip/cons/1008,Member of Parliament for Lincolnshire Northern,house-of-commons,Member of Parliament,1868,1885,Lincolnshire Northern
uk.org.publicwhip/cons/1009,Member of Parliament for Lincolnshire Southern,house-of-commons,Member of Parliament,1868,1885,Lincolnshire Southern
uk.org.publicwhip/cons/101,Member of Parliament for Bury North,house-of-commons,Member of Parliament,1983,,Bury North
uk.org.publicwhip/cons/1010,Member of Parliament for Middlesex,house-of-commons,Member of Parliament,1660,1885,Middlesex
uk.org.publicwhip/cons/1011,Member of Parliament for Norfolk Eastern,house-of-commons,Member of Parliament,1832,1868,Norfolk Eastern
uk.org.publicwhip/cons/1012,Member of Parliament for Norfolk Northern,house-of-commons,Member of Parliament,1868,1950,Norfolk Northern
uk.org.publicwhip/cons/1013,Member of Parliament for Norfolk Southern,house-of-commons,Member of Parliament,1868,1950,Norfolk Southern
uk.org.publicwhip/cons/1014,Member of Parliament for Norfolk Western,house-of-commons,Member of Parliament,1832,1885,Norfolk Western
uk.org.publicwhip/cons/1015,Member of Parliament for Northamptonshire Northern,house-of-commons,Member of Parliament,1832,1918,Northamptonshire Northern
uk.org.publicwhip/cons/1016,Member of Parliament for Northamptonshire Southern,house-of-commons,Member of Parliament,1832,1918,Northamptonshire Southern
uk.org.publicwhip/cons/1017,Member of Parliament for Northumberland Northern,house-of-commons,Member of Parliament,1832,1885,Northumberland Northern
uk.org.publicwhip/cons/1018,Member of Parliament for Northumberland Southern,house-of-commons,Member of Parliament,1832,1885,Northumberland Southern
uk.org.publicwhip/cons/1019,Member of Parliament for Nottinghamshire Northern,house-of-commons,Member of Parliament,1832,1885,Nottinghamshire Northern
uk.org.publicwhip/cons/102,Member of Parliament for Bury South,house-of-commons,Member of Parliament,1983,,Bury South
uk.org.publicwhip/cons/1020,Member of Parliament for Nottinghamshire Southern,house-of-commons,Member of Parliament,1832,1885,Nottinghamshire Southern
uk.org.publicwhip/cons/1021,Member of Parliament for Oxfordshire,house-of-commons,Member of Parliament,1660,1885,Oxfordshire
uk.org.publicwhip/cons/1022,Member of Parliament for Rutlandshire,house-of-commons,Member of Parliament,1660,1918,Rutlandshire
uk.org.publicwhip/cons/1023,Member of Parliament for Shropshire Northern,house-of-commons,Member of Parliament,1832,1885,Shropshire Northern
uk.org.publicwhip/cons/1024,Member of Parliament for Shropshire Southern,house-of-commons,Member of Parliament,1832,1885,Shropshire Southern
uk.org.publicwhip/cons/1025,Member of Parliament for Somerset Eastern,house-of-commons,Member of Parliament,1832,1918,Somerset Eastern
uk.org.publicwhip/cons/1026,Member of Parliament for Somerset Mid,house-of-commons,Member of Parliament,1868,1885,Somerset Mid
uk.org.publicwhip/cons/1027,Member of Parliament for Somerset Western,house-of-commons,Member of Parliament,1832,1885,Somerset Western
uk.org.publicwhip/cons/1028,Member of Parliament for Staffordshire Eastern,house-of-commons,Member of Parliament,1868,1885,Staffordshire Eastern
uk.org.publicwhip/cons/1029,Member of Parliament for Staffordshire Northern,house-of-commons,Member of Parliament,1832,1885,Staffordshire Northern
uk.org.publicwhip/cons/103,Member of Parliament for Bury St Edmunds,house-of-commons,Member of Parliament,1660,,Bury St Edmunds
uk.org.publicwhip/cons/1030,Member of Parliament for Staffordshire Southern,house-of-commons,Member of Parliament,1832,1868,Staffordshire Southern
uk.org.publicwhip/cons/1031,Member of Parliament for Staffordshire Western,house-of-commons,Member of Parliament,1868,1918,Staffordshire Western
uk.org.publicwhip/cons/1032,Member of Parliament for Suffolk Eastern,house-of-commons,Member of Parliament,1832,1885,Suffolk Eastern
uk.org.publicwhip/cons/1033,Member of Parliament for Suffolk Western,house-of-commons,Member of Parliament,1832,1885,Suffolk Western
uk.org.publicwhip/cons/1034,Member of Parliament for Surrey Eastern,house-of-commons,Member of Parliament,1832,1950,Surrey Eastern
uk.org.publicwhip/cons/1035,Member of Parliament for Surrey Mid,house-of-commons,Member of Parliament,1832,1885,Surrey Mid
uk.org.publicwhip/cons/1036,Member of Parliament for Surrey Western,house-of-commons,Member of Parliament,1832,1885,Surrey Western
uk.org.publicwhip/cons/1037,Member of Parliament for Sussex Eastern,house-of-commons,Member of Parliament,1832,1885,Sussex Eastern
uk.org.publicwhip/cons/1038,Member of Parliament for Sussex Western,house-of-commons,Member of Parliament,1832,1885,Sussex Western
uk.org.publicwhip/cons/1039,Member of Parliament for Warwickshire Northern,house-of-commons,Member of Parliament,1832,1885,Warwickshire Northern
uk.org.publicwhip/cons/104,Member of Parliament for Caernarfon,house-of-commons,Member of Parliament,1983,2010-05-05,Caernarfon
uk.org.publicwhip/cons/1040,Member of Parliament for Warwickshire Southern,house-of-commons,Member of Parliament,1832,1885,Warwickshire Southern
uk.org.publicwhip/cons/1041,Member of Parliament for Westmorland,house-of-commons,Member of Parliament,1660,1885,Westmorland
uk.org.publicwhip/cons/1042,Member of Parliament for Wiltshire Northern,house-of-commons,Member of Parliament,1832,1885,Wiltshire Northern
uk.org.publicwhip/cons/1043,Member of Parliament for Wiltshire Southern,house-of-commons,Member of Parliament,1832,1885,Wiltshire Southern
uk.org.publicwhip/cons/1044,Member of Parliament for Worcestershire Eastern,house-of-commons,Member of Parliament,1832,1918,Worcestershire Eastern
uk.org.publicwhip/cons/1045,Member of Parliament for Worcestershire Western,house-of-commons,Member of Parliament,1832,1885,Worcestershire Western
uk.org.publicwhip/cons/1046,Member of Parliament for Yorkshire (East Riding),house-of-commons,Member of Parliament,1832,1885,Yorkshire (East Riding)
uk.org.publicwhip/cons/1047,Member of Parliament for Yorkshire (North Riding),house-of-commons,Member of Parliament,1832,1885,Yorkshire (North Riding)
uk.org.publicwhip/cons/1048,Member of Parliament for Yorkshire (West Riding),house-of-commons,Member of Parliament,1832,1865,Yorkshire (West Riding)
uk.org.publicwhip/cons/1049,Member of Parliament for Yorkshire (West Riding) Eastern,house-of-commons,Member of Parliament,1868,1885,Yorkshire (West Riding) Eastern
uk.org.publicwhip/cons/105,Member of Parliament for Caerphilly,house-of-commons,Member of Parliament,1918,,Caerphilly
uk.org.publicwhip/cons/1050,Member of Parliament for Yorkshire (West Riding) Northern,house-of-commons,Member of Parliament,1865,1885,Yorkshire (West Riding) Northern
uk.org.publicwhip/cons/1051,Member of Parliament for Yorkshire (West Riding) Southern,house-of-commons,Member of Parliament,1865,1885,Yorkshire (West Riding) Southern
uk.org.publicwhip/cons/1052,Member of Parliament for Beaumaris District of Boroughs,house-of-commons,Member of Parliament,1659,1885,Beaumaris District of Boroughs
uk.org.publicwhip/cons/1053,Member of Parliament for Brecon,house-of-commons,Member of Parliament,1660,1885,Brecon
uk.org.publicwhip/cons/1054,Member of Parliament for Caernarvon District of Boroughs,house-of-commons,Member of Parliament,1660,1950,Caernarvon District of Boroughs
uk.org.publicwhip/cons/1055,Member of Parliament for Cardiff District of Boroughs,house-of-commons,Member of Parliament,1660,1918,Cardiff District of Boroughs
uk.org.publicwhip/cons/1056,Member of Parliament for Cardigan District of Boroughs,house-of-commons,Member of Parliament,1660,1885,Cardigan District of Boroughs
uk.org.publicwhip/cons/1057,Member of Parliament for Carmarthen District of Boroughs,house-of-commons,Member of Parliament,1660,1918,Carmarthen District of Boroughs
uk.org.publicwhip/cons/1058,Member of Parliament for Denbigh District of Boroughs,house-of-commons,Member of Parliament,1660,1918,Denbigh District of Boroughs
uk.org.publicwhip/cons/1059,Member of Parliament for Flint District of Boroughs,house-of-commons,Member of Parliament,1660,1918,Flint District of Boroughs
uk.org.publicwhip/cons/106,"Member of Parliament for Caithness, Sutherland and Easter Ross",house-of-commons,Member of Parliament,1997-05-01,,"Caithness, Sutherland and Easter Ross"
uk.org.publicwhip/cons/1060,Member of Parliament for Haverfordwest District of Boroughs,house-of-commons,Member of Parliament,1660,1885,Haverfordwest District of Boroughs
uk.org.publicwhip/cons/1061,Member of Parliament for Merthyr Tydfil,house-of-commons,Member of Parliament,1832,1918,Merthyr Tydfil
uk.org.publicwhip/cons/1062,Member of Parliament for Monmouth District of Boroughs,house-of-commons,Member of Parliament,1660,1918,Monmouth District of Boroughs
uk.org.publicwhip/cons/1063,Member of Parliament for Montgomery District of Boroughs,house-of-commons,Member of Parliament,1660,1918,Montgomery District of Boroughs
uk.org.publicwhip/cons/1064,Member of Parliament for Pembroke District of Boroughs,house-of-commons,Member of Parliament,1660,1885,Pembroke District of Boroughs
uk.org.publicwhip/cons/1065,Member of Parliament for Radnor District of Boroughs,house-of-commons,Member of Parliament,1542,1885,Radnor District of Boroughs
uk.org.publicwhip/cons/1066,Member of Parliament for Swansea District of Boroughs,house-of-commons,Member of Parliament,1832,1918,Swansea District of Boroughs
uk.org.publicwhip/cons/1067,Member of Parliament for Anglesey,house-of-commons,Member of Parliament,1660,1983,Anglesey
uk.org.publicwhip/cons/1068,Member of Parliament for Breconshire,house-of-commons,Member of Parliament,1660,1918,Breconshire
uk.org.publicwhip/cons/1069,Member of Parliament for Caernarvonshire,house-of-commons,Member of Parliament,1660,1885,Caernarvonshire
uk.org.publicwhip/cons/107,Member of Parliament for Calder Valley,house-of-commons,Member of Parliament,1983,,Calder Valley
uk.org.publicwhip/cons/1070,Member of Parliament for Cardiganshire,house-of-commons,Member of Parliament,1660,1974,Cardiganshire
uk.org.publicwhip/cons/1071,Member of Parliament for Denbighshire,house-of-commons,Member of Parliament,1660,1885,Denbighshire
uk.org.publicwhip/cons/10716,MSP for Central Scotland,scottish-parliament,MSP,1999-05-06,,Central Scotland
uk.org.publicwhip/cons/10717,MSP for Glasgow,scottish-parliament,MSP,1999-05-06,,Glasgow
uk.org.publicwhip/cons/10718,MSP for Highlands and Islands,scottish-parliament,MSP,1999-05-06,,Highlands and Islands
uk.org.publicwhip/cons/10719,MSP for Lothians,scottish-parliament,MSP,1999-05-06,2011-05-04,Lothians
uk.org.publicwhip/cons/1072,Member of Parliament for Flintshire,house-of-commons,Member of Parliament,1660,1950,Flintshire
uk.org.publicwhip/cons/10720,MSP for Mid Scotland and Fife,scottish-parliament,MSP,1999-05-06,,Mid Scotland and Fife
uk.org.publicwhip/cons/10721,MSP for North East Scotland,scottish-parliament,MSP,1999-05-06,,North East Scotland
uk.org.publicwhip/cons/10722,MSP for South of Scotland,scottish-parliament,MSP,1999-05-06,2011-05-04,South of Scotland
uk.org.publicwhip/cons/10723,MSP for West of Scotland,scottish-parliament,MSP,1999-05-06,2011-05-04,West of Scotland
uk.org.publicwhip/cons/10724,MSP for Aberdeen Central,scottish-parliament,MSP,1999-05-06,,Aberdeen Central
uk.org.publicwhip/cons/10725,MSP for Aberdeen North,scottish-parliament,MSP,1999-05-06,2011-05-04,Aberdeen North
uk.org.publicwhip/cons/10726,MSP for Aberdeen South,scottish-parliament,MSP,1999-05-06,2011-05-04,Aberdeen South
uk.org.publicwhip/cons/10727,MSP for Airdrie and Shotts,scottish-parliament,MSP,1999-05-06,,Airdrie and Shotts
uk.org.publicwhip/cons/10728,MSP for Angus,scottish-parliament,MSP,1999-05-06,2011-05-04,Angus
uk.org.publicwhip/cons/10729,MSP for Argyll and Bute,scottish-parliament,MSP,1999-05-06,,Argyll and Bute
uk.org.publicwhip/cons/1073,Member of Parliament for Glamorganshire,house-of-commons,Member of Parliament,1660,1885,Glamorganshire
uk.org.publicwhip/cons/10730,MSP for Ayr,scottish-parliament,MSP,1999-05-06,,Ayr
uk.org.publicwhip/cons/10731,MSP for Banff and Buchan,scottish-parliament,MSP,1999-05-06,2011-05-04,Banff and Buchan
uk.org.publicwhip/cons/10732,"MSP for Caithness, Sutherland and Easter Ross",scottish-parliament,MSP,1999-05-06,2011-05-04,"Caithness, Sutherland and Easter Ross"
uk.org.publicwhip/cons/10733,"MSP for Carrick, Cumnock and Doon Valley",scottish-parliament,MSP,1999-05-06,,"Carrick, Cumnock and Doon Valley"
uk.org.publicwhip/cons/10734,MSP for Central Fife,scottish-parliament,MSP,1999-05-06,2011-05-04,Central Fife
uk.org.publicwhip/cons/10735,MSP for Clydebank and Milngavie,scottish-parliament,MSP,1999-05-06,,Clydebank and Milngavie
uk.org.publicwhip/cons/10736,MSP for Clydesdale,scottish-parliament,MSP,1999-05-06,,Clydesdale
uk.org.publicwhip/cons/10737,MSP for Coatbridge and Chryston,scottish-parliament,MSP,1999-05-06,,Coatbridge and Chryston
uk.org.publicwhip/cons/10738,MSP for Cumbernauld and Kilsyth,scottish-parliament,MSP,1999-05-06,,Cumbernauld and Kilsyth
uk.org.publicwhip/cons/10739,MSP for Cunninghame North,scottish-parliament,MSP,1999-05-06,,Cunninghame North
uk.org.publicwhip/cons/1074,Member of Parliament for Merionethshire,house-of-commons,Member of Parliament,1660,1974,Merionethshire
uk.org.publicwhip/cons/10740,MSP for Cunninghame South,scottish-parliament,MSP,1999-05-06,,Cunninghame South
uk.org.publicwhip/cons/10741,MSP for Dumbarton,scottish-parliament,MSP,1999-05-06,,Dumbarton
uk.org.publicwhip/cons/10742,MSP for Dumfries,scottish-parliament,MSP,1999-05-06,2011-05-04,Dumfries
uk.org.publicwhip/cons/10743,MSP for Dundee East,scottish-parliament,MSP,1999-05-06,2011-05-04,Dundee East
uk.org.publicwhip/cons/10744,MSP for Dundee West,scottish-parliament,MSP,1999-05-06,2011-05-04,Dundee West
uk.org.publicwhip/cons/10745,MSP for Dunfermline East,scottish-parliament,MSP,1999-05-06,2011-05-04,Dunfermline East
uk.org.publicwhip/cons/10746,MSP for Dunfermline West,scottish-parliament,MSP,1999-05-06,2011-05-04,Dunfermline West
uk.org.publicwhip/cons/10747,MSP for East Kilbride,scottish-parliament,MSP,1999-05-06,,East Kilbride
uk.org.publicwhip/cons/10748,MSP for East Lothian,scottish-parliament,MSP,1999-05-06,,East Lothian
uk.org.publicwhip/cons/10749,MSP for Eastwood,scottish-parliament,MSP,1999-05-06,,Eastwood
uk.org.publicwhip/cons/1075,Member of Parliament for Monmouthshire,house-of-commons,Member of Parliament,1660,1885,Monmouthshire
uk.org.publicwhip/cons/10750,MSP for Edinburgh Central,scottish-parliament,MSP,1999-05-06,,Edinburgh Central
uk.org.publicwhip/cons/10751,MSP for Edinburgh East and Musselburgh,scottish-parliament,MSP,1999-05-06,2011-05-04,Edinburgh East and Musselburgh
uk.org.publicwhip/cons/10752,MSP for Edinburgh North and Leith,scottish-parliament,MSP,1999-05-06,2011-05-04,Edinburgh North and Leith
uk.org.publicwhip/cons/10753,MSP for Edinburgh Pentlands,scottish-parliament,MSP,1999-05-06,,Edinburgh Pentlands
uk.org.publicwhip/cons/10754,MSP for Edinburgh South,scottish-parliament,MSP,1999-05-06,2011-05-04,Edinburgh South
uk.org.publicwhip/cons/10755,MSP for Edinburgh West,scottish-parliament,MSP,1999-05-06,2011-05-04,Edinburgh West
uk.org.publicwhip/cons/10756,MSP for Falkirk East,scottish-parliament,MSP,1999-05-06,,Falkirk East
uk.org.publicwhip/cons/10757,MSP for Falkirk West,scottish-parliament,MSP,1999-05-06,,Falkirk West
uk.org.publicwhip/cons/10758,MSP for Galloway and Upper Nithsdale,scottish-parliament,MSP,1999-05-06,2011-05-04,Galloway and Upper Nithsdale
uk.org.publicwhip/cons/10759,MSP for Glasgow Anniesland,scottish-parliament,MSP,1999-05-06,,Glasgow Anniesland
uk.org.publicwhip/cons/1076,Member of Parliament for Pembrokeshire,house-of-commons,Member of Parliament,1660,1974,Pembrokeshire
uk.org.publicwhip/cons/10760,MSP for Glasgow Baillieston,scottish-parliament,MSP,1999-05-06,2011-05-04,Glasgow Baillieston
uk.org.publicwhip/cons/10761,MSP for Glasgow Cathcart,scottish-parliament,MSP,1999-05-06,,Glasgow Cathcart
uk.org.publicwhip/cons/10762,MSP for Glasgow Govan,scottish-parliament,MSP,1999-05-06,2011-05-04,Glasgow Govan
uk.org.publicwhip/cons/10763,MSP for Glasgow Kelvin,scottish-parliament,MSP,1999-05-06,,Glasgow Kelvin
uk.org.publicwhip/cons/10764,MSP for Glasgow Maryhill,scottish-parliament,MSP,1999-05-06,2011-05-04,Glasgow Maryhill
uk.org.publicwhip/cons/10765,MSP for Glasgow Pollok,scottish-parliament,MSP,1999-05-06,,Glasgow Pollok
uk.org.publicwhip/cons/10766,MSP for Glasgow Rutherglen,scottish-parliament,MSP,1999-05-06,2011-05-04,Glasgow Rutherglen
uk.org.publicwhip/cons/10767,MSP for Glasgow Shettleston,scottish-parliament,MSP,1999-05-06,,Glasgow Shettleston
uk.org.publicwhip/cons/10768,MSP for Glasgow Springburn,scottish-parliament,MSP,1999-05-06,2011-05-04,Glasgow Springburn
uk.org.publicwhip/cons/10769,MSP for Gordon,scottish-parliament,MSP,1999-05-06,2011-05-04,Gordon
uk.org.publicwhip/cons/1077,Member of Parliament for Radnorshire,house-of-commons,Member of Parliament,1660,1918,Radnorshire
uk.org.publicwhip/cons/10770,MSP for Greenock and Inverclyde,scottish-parliament,MSP,1999-05-06,,Greenock and Inverclyde
uk.org.publicwhip/cons/10771,MSP for Hamilton North and Bellshill,scottish-parliament,MSP,1999-05-06,2011-05-04,Hamilton North and Bellshill
uk.org.publicwhip/cons/10772,MSP for Hamilton South,scottish-parliament,MSP,1999-05-06,2011-05-04,Hamilton South
uk.org.publicwhip/cons/10773,"MSP for Inverness East, Nairn and Lochaber",scottish-parliament,MSP,1999-05-06,2011-05-04,"Inverness East, Nairn and Lochaber"
uk.org.publicwhip/cons/10774,MSP for Kilmarnock and Loudoun,scottish-parliament,MSP,1999-05-06,2011-05-04,Kilmarnock and Loudoun
uk.org.publicwhip/cons/10775,MSP for Kirkcaldy,scottish-parliament,MSP,1999-05-06,,Kirkcaldy
uk.org.publicwhip/cons/10776,MSP for Linlithgow,scottish-parliament,MSP,1999-05-06,,Linlithgow
uk.org.publicwhip/cons/10777,MSP for Livingston,scottish-parliament,MSP,1999-05-06,2011-05-04,Livingston
uk.org.publicwhip/cons/10778,MSP for Midlothian,scottish-parliament,MSP,1999-05-06,2011-05-04,Midlothian
uk.org.publicwhip/cons/10779,MSP for Moray,scottish-parliament,MSP,1999-05-06,,Moray
uk.org.publicwhip/cons/1078,Member of Parliament for Aberdeen,house-of-commons,Member of Parliament,1708,1885,Aberdeen
uk.org.publicwhip/cons/10780,MSP for Motherwell and Wishaw,scottish-parliament,MSP,1999-05-06,,Motherwell and Wishaw
uk.org.publicwhip/cons/10781,MSP for North East Fife,scottish-parliament,MSP,1999-05-06,,North East Fife
uk.org.publicwhip/cons/10782,MSP for North Tayside,scottish-parliament,MSP,1999-05-06,2011-05-04,North Tayside
uk.org.publicwhip/cons/10783,MSP for Ochil,scottish-parliament,MSP,1999-05-06,2011-05-04,Ochil
uk.org.publicwhip/cons/10784,MSP for Orkney Islands,scottish-parliament,MSP,1999-05-06,,Orkney Islands
uk.org.publicwhip/cons/10785,MSP for Paisley North,scottish-parliament,MSP,1999-05-06,2011-05-04,Paisley North
uk.org.publicwhip/cons/10786,MSP for Paisley South,scottish-parliament,MSP,1999-05-06,2011-05-04,Paisley South
uk.org.publicwhip/cons/10787,MSP for Perth,scottish-parliament,MSP,1999-05-06,2011-05-04,Perth
uk.org.publicwhip/cons/10788,"MSP for Ross, Skye and Inverness West",scottish-parliament,MSP,1999-05-06,2011-05-04,"Ross, Skye and Inverness West"
uk.org.publicwhip/cons/10789,MSP for Roxburgh and Berwickshire,scottish-parliament,MSP,1999-05-06,2011-05-04,Roxburgh and Berwickshire
uk.org.publicwhip/cons/1079,Member of Parliament for Ayr District of Burghs,house-of-commons,Member of Parliament,1708,1950,Ayr District of Burghs
uk.org.publicwhip/cons/10790,MSP for Shetland Islands,scottish-parliament,MSP,1999-05-06,,Shetland Islands
uk.org.publicwhip/cons/10791,MSP for Stirling,scottish-parliament,MSP,1999-05-06,,Stirling
uk.org.publicwhip/cons/10792,MSP for Strathkelvin and Bearsden,scottish-parliament,MSP,1999-05-06,,Strathkelvin and Bearsden
uk.org.publicwhip/cons/10793,"MSP for Tweeddale, Ettrick and Lauderdale",scottish-parliament,MSP,1999-05-06,2011-05-04,"Tweeddale, Ettrick and Lauderdale"
uk.org.publicwhip/cons/10794,MSP for West Aberdeenshire and Kincardine,scottish-parliament,MSP,1999-05-06,2011-05-04,West Aberdeenshire and Kincardine
uk.org.publicwhip/cons/10795,MSP for Western Isles,scottish-parliament,MSP,1999-05-06,2011-05-04,Western Isles
uk.org.publicwhip/cons/10796,MSP for West Renfrewshire,scottish-parliament,MSP,1999-05-06,2011-05-04,West Renfrewshire
uk.org.publicwhip/cons/10797,MSP for Aberdeen Donside,scottish-parliament,MSP,2011-05-05,,Aberdeen Donside
uk.org.publicwhip/cons/10798,MSP for Aberdeen South and North Kincardine,scottish-parliament,MSP,2011-05-05,,Aberdeen South and North Kincardine
uk.org.publicwhip/cons/10799,MSP for Aberdeenshire East,scottish-parliament,MSP,2011-05-05,,Aberdeenshire East
uk.org.publicwhip/cons/108,Member of Parliament for Camberwell and Peckham,house-of-commons,Member of Parliament,1997-05-01,,Camberwell and Peckham
uk.org.publicwhip/cons/1080,Member of Parliament for Dumfries District of Burghs,house-of-commons,Member of Parliament,1708,1918,Dumfries District of Burghs
uk.org.publicwhip/cons/10800,MSP for Aberdeenshire West,scottish-parliament,MSP,2011-05-05,,Aberdeenshire West
uk.org.publicwhip/cons/10801,MSP for Almond Valley,scottish-parliament,MSP,2011-05-05,,Almond Valley
uk.org.publicwhip/cons/10802,MSP for Angus North and Mearns,scottish-parliament,MSP,2011-05-05,,Angus North and Mearns
uk.org.publicwhip/cons/10803,MSP for Angus South,scottish-parliament,MSP,2011-05-05,,Angus South
uk.org.publicwhip/cons/10804,MSP for Banffshire and Buchan Coast,scottish-parliament,MSP,2011-05-05,,Banffshire and Buchan Coast
uk.org.publicwhip/cons/10805,"MSP for Caithness, Sutherland and Ross",scottish-parliament,MSP,2011-05-05,,"Caithness, Sutherland and Ross"
uk.org.publicwhip/cons/10806,MSP for Clackmannanshire and Dunblane,scottish-parliament,MSP,2011-05-05,,Clackmannanshire and Dunblane
uk.org.publicwhip/cons/10807,MSP for Cowdenbeath,scottish-parliament,MSP,2011-05-05,,Cowdenbeath
uk.org.publicwhip/cons/10808,MSP for Dumfriesshire,scottish-parliament,MSP,2011-05-05,,Dumfriesshire
uk.org.publicwhip/cons/10809,MSP for Dundee City East,scottish-parliament,MSP,2011-05-05,,Dundee City East
uk.org.publicwhip/cons/1081,Member of Parliament for Dundee,house-of-commons,Member of Parliament,1832,1950,Dundee
uk.org.publicwhip/cons/10810,MSP for Dundee City West,scottish-parliament,MSP,2011-05-05,,Dundee City West
uk.org.publicwhip/cons/10811,MSP for Dunfermline,scottish-parliament,MSP,2011-05-05,,Dunfermline
uk.org.publicwhip/cons/10812,MSP for Edinburgh Eastern,scottish-parliament,MSP,2011-05-05,,Edinburgh Eastern
uk.org.publicwhip/cons/10813,MSP for Edinburgh Northern and Leith,scottish-parliament,MSP,2011-05-05,,Edinburgh Northern and Leith
uk.org.publicwhip/cons/10814,MSP for Edinburgh Southern,scottish-parliament,MSP,2011-05-05,,Edinburgh Southern
uk.org.publicwhip/cons/10815,MSP for Edinburgh Western,scottish-parliament,MSP,2011-05-05,,Edinburgh Western
uk.org.publicwhip/cons/10816,MSP for Na h-Eileanan an Iar,scottish-parliament,MSP,2011-05-05,,Na h-Eileanan an Iar
uk.org.publicwhip/cons/10817,"MSP for Ettrick, Roxburgh and Berwickshire",scottish-parliament,MSP,2011-05-05,,"Ettrick, Roxburgh and Berwickshire"
uk.org.publicwhip/cons/10818,MSP for Galloway and West Dumfries,scottish-parliament,MSP,2011-05-05,,Galloway and West Dumfries
uk.org.publicwhip/cons/10819,MSP for Glasgow Maryhill and Springburn,scottish-parliament,MSP,2011-05-05,,Glasgow Maryhill and Springburn
uk.org.publicwhip/cons/1082,Member of Parliament for Elgin District of Burghs,house-of-commons,Member of Parliament,1708,1918,Elgin District of Burghs
uk.org.publicwhip/cons/10820,MSP for Glasgow Provan,scottish-parliament,MSP,2011-05-05,,Glasgow Provan
uk.org.publicwhip/cons/10821,MSP for Glasgow Southside,scottish-parliament,MSP,2011-05-05,,Glasgow Southside
uk.org.publicwhip/cons/10822,"MSP for Hamilton, Larkhall and Stonehouse",scottish-parliament,MSP,2011-05-05,,"Hamilton, Larkhall and Stonehouse"
uk.org.publicwhip/cons/10823,MSP for Inverness and Nairn,scottish-parliament,MSP,2011-05-05,,Inverness and Nairn
uk.org.publicwhip/cons/10824,MSP for Kilmarnock and Irvine Valley,scottish-parliament,MSP,2011-05-05,,Kilmarnock and Irvine Valley
uk.org.publicwhip/cons/10825,MSP for Mid Fife and Glenrothes,scottish-parliament,MSP,2011-05-05,,Mid Fife and Glenrothes
